id-berita,url,content per paragraf,content_stopwords
302,https://tekno.sindonews.com/read/512958/776/telkomsel-maknai-kemerdekaan-ri-ke-76-dengan-semangat-tetap-tangguh-dan-terus-bukapeluangtumbuh-untuk-indonesia-1629137291,"Dengan begitu, Telkomsel memastikan agar setiap langkah, inovasi, dan kontribusi nyata dari #YangKitaBisa berikan akan membuka lebih banyak peluang bagi seluruh lapisan masyarakat melewati berbagai tantangan di setiap situasi guna mewujudkan semangat Indonesia Tumbuh Indonesia Tangguh. Direktur Utama Telkomsel Hendri Mulya Syam mengatakan, hari kemerdekaan merupakan momen tepat bagi bangsa Indonesia untuk bersama kembali memaknai perjalanan panjang yang sudah dilalui oleh bangsa. Para pendahulu telah menunjukkan ketangguhannya dalam melalui berbagai tantangan di tiap fase kehidupan.",telkomsel langkah inovasi kontribusi nyata yangkitabisa ikan buka peluang lapis masyarakat tantang situasi wujud semangat indonesia tumbuh indonesia tangguh direktur utama telkomsel hendri mulya syam merdeka rupa momen bangsa indonesia makna jalan bangsa tangguh tantang fase hidup
302,https://tekno.sindonews.com/read/512958/776/telkomsel-maknai-kemerdekaan-ri-ke-76-dengan-semangat-tetap-tangguh-dan-terus-bukapeluangtumbuh-untuk-indonesia-1629137291,"Telkomsel juga menghadirkan berbagai program khusus bagi pengembangan talenta digital Indonesia, diantaranya seperti program Tinc yang fokus mengakselerasi startup tanah air di tahap seed funding dan memperkuat nilai yang dapat diberikannya bagi target sasaran. The NextDev yang hadir sebagai wadah bagi talenta digital Indonesia dalam menghadirkan solusi berbasis aplikasi yang mampu memberikan kontribusi nyata bagi kemajuan bangsa, program IndonesiaNEXT untuk mendukung pertumbuhan semangat siap kerja dan kewirausahaan demi meningkatkan daya saing generasi muda kita hingga ke tingkat global. Tak ketinggalan, Telkomsel membuka lab inovasi Inno[X]tion untuk meningkatkan kapabilitas SDM Telkomsel sehingga mampu memberi nilai tambah yang mampu membantu pertumbuhan negeri di setiap produk, layanan, dan inovasi yang dirancang.",telkomsel hadir program khusus kembang talenta digital indonesia program tinc fokus akselerasi startup tanah air tahap seed funding kuat nilai target sasar the nextdev hadir wadah talenta digital indonesia hadir solusi basis aplikasi kontribusi nyata maju bangsa program indonesianext dukung tumbuh semangat kerja kewirausahaan tingkat daya saing generasi muda tingkat global tinggal telkomsel buka lab inovasi inno x tion tingkat kapabilitas sdm telkomsel nilai bantu tumbuh negeri produk layan inovasi rancang
304,https://tekno.sindonews.com/read/482556/776/xu-ziyang-ceo-zte-corporation-dorong-digitalisasi-dengan-teknologi-cerdas-pidato-yang-disampaikan-dalam-mobile-world-congress-2021-1626235655,"Selanjutnya, sejalan dengan revolusi industri modern, kami mengembangkan teknologi informasi untuk mempercepat pembangunan sosial. Contohnya, pabrik pintar (Smart Factory) yang bertransformasi dari manufaktur tradisional, mampu menghemat biaya sekaligus meningkatkan efisiensi dan kualitas. Infrastruktur lalu lintas yang cerdas memfasilitasi emisi rendah karbon dan transportasi yang lebih efektif. 5G membantu membangun jaringan pintar yang andal, aman, ekonomis, efisien, dan ramah lingkungan dengan konektivitas secara luas, latensi rendah dan biaya rendah yang pada akhirnya akan mengurangi emisi karbon. Dengan 5G, manajemen cerdas dapat menjadi kenyataan di sektor pertanian.",jalan revolusi industri modern kembang teknologi informasi cepat bangun sosial contoh pabrik pintar smart factory transformasi manufaktur tradisional hemat biaya tingkat efisiensi kualitas infrastruktur lintas cerdas fasilitas emisi rendah karbon transportasi efektif g bantu bangun jaring pintar andal aman ekonomis efisien ramah lingkung konektivitas luas latensi rendah biaya rendah emisi karbon g manajemen cerdas nyata sektor tani
305,https://tekno.sindonews.com/read/482520/776/zte-menampilkan-berbagai-solusi-dan-produk-inovatif-di-mwc-2021-1626232068,"Sementara untuk jaringan kabel, ZTE telah memberikan pengalaman broadband yang sangat baik melalui seluruh jaringan optik. Di sisi akses optik, ZTE telah melayani 1/4 pelanggan FTTx di seluruh dunia dengan produk dan solusi yang mutakhir untuk memfasilitasi transformasi optik global. Dalam hal jaringan transportasi optik, evolusi berkelanjutan berjalan melalui inovasi teknis dalam tiga arah yakni peningkatan bandwidth, rekonstruksi topologi, dan transformasi layanan. Contohnya, produk 1.2T dengan panjang gelombang tunggal pertama di industri mencapai kinerja transmisi maksimum.",jaring kabel zte alam broadband jaring optik sisi akses optik zte layan langgan fttx dunia produk solusi mutakhir fasilitas transformasi optik global jaring transportasi optik evolusi jalan inovasi teknis arah tingkat bandwidth rekonstruksi topologi transformasi layan contoh produk t gelombang tunggal industri capai kerja transmisi maksimum
305,https://tekno.sindonews.com/read/482520/776/zte-menampilkan-berbagai-solusi-dan-produk-inovatif-di-mwc-2021-1626232068,"Dalam hal infrastruktur cloud, ZTE telah mengintegrasikan edge cloud terdistribusi dengan jaringan yang disediakan oleh teknologi IT dan CT, dan telah bekerja sama dengan operator untuk mendorong transformasi digital industri melalui komponen modul yang fleksibel. Mengenai jaringan pribadi perusahaan, ZTE memiliki rangkaian produk terlengkap, penyesuaian SLA yang tepat, dan one-stop delivery yang selanjutnya memfasilitasi transformasi digital dan peningkatan industri serta menyediakan model bisnis baru bagi operator untuk menjelajahi pasar ToB. Sementara itu, ZTE menggunakan platform Mesagging terbaru di era 5G untuk membantu operator dalam meningkatkan tingkat konversi bisnis dan efisiensi layanan mereka untuk industri vertikal. Melalui diversifikasi pengisian B2B, operator dapat mengontrol jalur akses lalu lintas seluler dan meningkatkan pendapatan dari pasar ToB.",infrastruktur cloud zte integrasi edge cloud distribusi jaring sedia teknologi it ct kerja operator dorong transformasi digital industri komponen modul fleksibel kena jaring pribadi usaha zte milik rangkai produk lengkap suai sla one-stop delivery fasilitas transformasi digital tingkat industri sedia model bisnis operator jelajah pasar tob zte platform mesagging era g bantu operator tingkat tingkat konversi bisnis efisiensi layan industri vertikal diversifikasi isi bb operator kontrol jalur akses lintas seluler tingkat pasar tob
308,https://tekno.sindonews.com/read/474336/776/zte-dan-telkomsel-hadirkan-skenario-penggunaan-5g-pada-peluncuran-telkomsel-5g-1625450849,"""Ke depan, ZTE akan terus memfasilitasi operator dalam menyebarkan jaringan dan mengambil langkah awal dalam komersialisasi 5G melalui solusi dan produk yang inovatif dan andal untuk bersama-sama mengeksplorasi perkembangan industri 5G,"" lanjut Erick Xu. Hendri Mulya Syam, Direktur Utama Telkomsel, mengatakan, Telkomsel selalu menjadi yang terdepan dalam teknologi telekomunikasi di Indonesia. ""Selama beberapa tahun terakhir, kami telah berinvestasi secara signifikan untuk membangun pengetahuan praktis mengenai 5G, pengembangan talenta, dan serangkaian rancangan komprehensif dalam menghadirkan 5G ke Indonesia,"" katanya. Untuk itu, ungkap dia, sangat senang dapat menjadi operator pertama yang meluncurkan 5G di Indonesia.",zte fasilitas operator sebar jaring ambil langkah komersialisasi g solusi produk inovatif andal eksplorasi kembang industri g erick xu hendri mulya syam direktur utama telkomsel telkomsel teknologi telekomunikasi indonesia investasi signifikan bangun praktis kena g kembang talenta rangkai rancang komprehensif hadir g indonesia senang operator luncur g indonesia
312,https://otomotif.sindonews.com/read/787347/778/begini-sensasi-mengendarai-all-new-hondabr-v-untuk-perjalanan-jauh-bersama-keluarga-1654236414,"4. Hemat Bahan Bakar. SINDOnews cukup kagum dengan pengalaman berkendara yang mengasyikkan, ternyata All New HondaBR-V tetap hemat konsumsi bahan bakarnya. Di atas kertas, lebih irit 3% dibanding model sebelumnya. Ini penting, terutama saat mudik dan membawa banyak anggota keluarga. Bahan bakar yang irit selalu jadi nilai plus. Catatan SINDOnews di jalan tol Jakarta-Semarang mencapai 22 km/liter.",hemat bahan bakar sindonews kagum alam kendara asyik nyata all new hondabr-v hemat konsumsi bahan bakar kertas irit banding model utama mudik bawa anggota keluarga bahan bakar irit nilai plus catat sindonews jalan tol jakarta-semarang capai km liter
316,https://otomotif.sindonews.com/read/737447/778/sediakan-layanan-after-sales-mitsubishi-tawarkan-banyak-diskon-di-iims-2022-1649408664,"Berbagai promo menarik yang ditawarkan ini berupa diskon mulai dari 5% hingga 34% untuk pembelian aksesoris maupun suku cadang. Di antaranya, diskon 10% untuk pembelian paket genuine accessories New Xpander, bagi konsumen yang melakukan pembelian New Xpander di event IIMS 2022. Diskon ini berlaku untuk seluruh paket Genuine Accessories Mitsubishi (kecuali safety). Paket aksesoris tersebut berupa Interior, Basic, Safety, Airdam, Aero, Aero Plus, Platinum.",promo tarik tawar rupa diskon beli aksesoris suku cadang diskon beli paket genuine accessories new xpander konsumen laku beli new xpander event iims diskon laku paket genuine accessories mitsubishi kecuali safety paket aksesoris rupa interior basic safety airdam aero aero plus platinum
