id-berita,url,content per paragraf,content_stopwords
231,https://tekno.sindonews.com/read/799655/776/manfaatkan-fitur-assistive-ball-di-oppo-a96-lakukan-banyak-hal-hanya-dengan-satu-jari-1655352411,Berikut ini adalah berbagai macam fungsi yang bisa didiakses menggunakan fitur Assistive Ball: - Kembali ke halaman sebelumnya. - Buka Layar Beranda. - Lihat Recent Task. - Buka Pusat Pemberitahuan. - Mengunci layar. - Mode Operasi Satu Tangan. - Ambil screenshot / tangkapan layar.,fungsi akses fitur assistive ball - halaman - buka layar beranda - lihat recent task - buka pusat - kunci layar - mode operasi tangan - ambil screenshot tangkap layar
235,https://tekno.sindonews.com/read/787787/776/zipmex-dan-komunitas-nft-kaiju-kingz-adakan-gathering-pertama-di-indonesia-1654257969,"Zipmex, salah satu platform aset digital dengan pertumbuhan tertinggi di Asia Pasifik, berkolaborasi dengan komunitas Kaiju Kingz menyelenggarakan gathering pertama bagi pemilik NFT Kaiju Kingz di Indonesia. Gathering kolaborasi Komunitas Pemilik NFT Kaiju Kingz dan Zipmex diadakan pada 20 Mei 2022 lalu di Kilakila by Akasya. Acara yang diadakan untuk pertama kalinya di Indonesia ini dihadiri secara eksklusif oleh 125 orang pemilik NFT Kaiju Kingz dari Indonesia dan Singapura.",zipmex salah platform aset digital tumbuh asia pasifik kolaborasi komunitas kaiju kingz selenggara gathering milik nft kaiju kingz indonesia gathering kolaborasi komunitas milik nft kaiju kingz zipmex adakan mei kilakila by akasya acara adakan kali indonesia hadir eksklusif orang milik nft kaiju kingz indonesia singapura
237,https://tekno.sindonews.com/read/778473/776/berkendara-aman-dengan-fitur-smart-driving-di-oppo-a55-1653386756,"Bermain smartphone saat tengah mengendarai mobil merupakan salah satu kebiasaan buruk yang dapat berakibat fatal. Konsentrasi saat berkendara akan terganggu, yang bisa menyebabkan terjadinya kecelakaan. Nah untuk kalian yang memiliki kebiasaan ini, mulai sekarang coba untuk dikurangi. Atau kalau bisa gunakanlah fitur khusus berkendara, seperti fitur Smart Drive yang ada di smartphone OPPO A55 yang dirilis pada bulan Maret lalu.",main smartphone kendara mobil rupa salah buruk akibat fatal konsentrasi kendara ganggu celaka milik coba fitur khusus kendara fitur smart drive smartphone oppo a rilis maret
255,https://tekno.sindonews.com/read/733149/776/laptop-cakep-untuk-produktivitas-serba-cepat-huawei-matebook-d14-dan-d15-segera-meluncur-di-indonesia-1649063073,"Fitur Software pada HUAWEI MateBook D14 dan D15 untuk Produktivitas Serba Cepat, Cocok untuk Setiap Skenario HUAWEI MateBook D14 dan D15 hadir dengan kemampuan-kemampuan unik yang hanya ditemukan pada rangkaian laptop Huawei yang dapat mempermudah penggunanya untuk meningkatkan produktivitas dengan lebih cepat. HUAWEI MateBook D14 dan D15 hadir dengan Fingerprint Power Button yang memungkin para penggunanya untuk kembali log-in dengan cepat, hanya butuh satu langkah dan kurang dari 5 detik saja untuk masuk kembali sekaligus verifikasi keamanan menggunakan sidik jari, pengguna tidak perlu lagi mengetik kunci (password) atau PIN laptop.",fitur software huawei matebook d d produktivitas serba cepat cocok skenario huawei matebook d d hadir unik temu rangkai laptop huawei mudah tingkat produktivitas cepat huawei matebook d d hadir fingerprint power button log-in cepat butuh langkah detik masuk verifikasi aman sidik jari tik kunci password pin laptop
256,https://tekno.sindonews.com/read/715303/776/gandeng-senayan-city-biznet-gelar-sentra-vaksinasi-booster-untuk-masyarakat-1647493407,"Halina, Leasing & Marketing Communication Director Senayan City mengatakan, “Senayan City secara konsisten menjalankan protokol kesehatan sesuai anjuran pemerintah. Senayan City rutin menyelenggarakan vaksinasi dosis 1 dan 2 sejak tahun lalu dan tahun ini kembali dilanjutkan dengan menyelenggarakan vaksinasi booster guna mendukung program pemerintah dalam upaya menuju Indonesia sehat, Senayan City bekerjasama dengan Biznet telah menyiapkan 3.000 vaksin booster untuk masyarakat umum secara gratis. Dengan hadirnya kegiatan ini diharapkan dapat membantu masyarakat umum untuk bisa mendapatkan vaksin booster dengan mudah di tempat yang nyaman dan aman. Selain itu, kami juga ingin mengajak masyarakat untuk semakin peduli dengan terus meningkatkan imunitas agar terlindungi dari penyebaran virus dan Indonesia bisa bebas Covid-19.",halina leasing marketing communication director senayan city senayan city konsisten jalan protokol sehat sesuai anjur perintah senayan city rutin selenggara vaksinasi dosis selenggara vaksinasi booster dukung program perintah upaya tuju indonesia sehat senayan city bekerjasama biznet vaksin booster masyarakat gratis hadir giat harap bantu masyarakat vaksin booster mudah nyaman aman ajak masyarakat peduli tingkat imunitas lindung sebar virus indonesia bebas covid-
260,https://tekno.sindonews.com/read/702041/776/asus-expertbook-b5-flip-adalah-laptop-convertible-untuk-pebisnis-yang-dinamis-1646291011,"Bekerja menggunakan ExpertBook B5 Flip (B5302F) dapat lebih nyaman tidak hanya berkat performanya yang tanpa kompromi tetapi juga fitur lainnya, salah satunya adalah konektivitas. ExpertBook B5 Flip (B5302F) telah dilengkapi dengan modul WiFi 6 (802.11ax) untuk memastikan koneksi WiFi yang stabil dan kencang. Selain itu, ExpertBook B5 Flip (B5302F) juga hadir dengan port Thunderbolt 4 yang dapat digunakan sebagai sarana transfer data berkecepatan tinggi, fasilitas untuk menghubungkan monitor eksternal beresolusi tinggi, hingga dapat digunakan untuk mengisi daya.",kerja expertbook b flip bf nyaman berkat performa kompromi fitur salah konektivitas expertbook b flip bf lengkap modul wifi ax koneksi wifi stabil kencang expertbook b flip bf hadir port thunderbolt sarana transfer data cepat fasilitas hubung monitor eksternal resolusi isi daya
260,https://tekno.sindonews.com/read/702041/776/asus-expertbook-b5-flip-adalah-laptop-convertible-untuk-pebisnis-yang-dinamis-1646291011,"Daya Tahan Baterai Panjang. ASUS merancang ExpertBook B5 Flip (B5302F) sebagai laptop yang selalu dapat diandalkan, bahkan saat berkegiatan seharian. ExpertBook B5 Flip (B5302F) memiliki daya tahan baterai hingga 14 jam dalam satu kali pengisian daya hingga penuh (100%). Salah satu rahasia daya tahan baterainya terletak pada penggunaan teknologi Panel Self-Refresh yang membuat konsumsi daya oleh layar dapat dikurangi secara signifikan. ExpertBook B5 Flip (B5302F) juga dilengkapi dengan teknologi fast-charge yang memungkinkan pengisian daya hingga 60% dalam pengisian daya selama 39 menit. Fitur tersebut sangat penting dalam mendukung kegiatan para pebisnis yang semakin dinamis.",daya tahan baterai asus rancang expertbook b flip bf laptop andal giat expertbook b flip bf milik daya tahan baterai jam kali isi daya penuh salah rahasia daya tahan baterai letak teknologi panel self-refresh konsumsi daya layar signifikan expertbook b flip bf lengkap teknologi fast-charge isi daya isi daya menit fitur dukung giat bisnis dinamis
264,https://tekno.sindonews.com/read/688539/776/galaxy-s22-series-5g-mana-yang-cocok-untuk-gaya-hidup-epic-kamu-1645063367,"Samsung Galaxy S22 Series 5G bisa jadi pilihan tepat. Gadget ini sangat praktis, sehingga tidak memakan tempat saat dibawa. Bila tak sedang banyak aktivitas, gadget ini cukup berfungsi sebagai ponsel.",samsung galaxy s series g pilih gadget praktis makan bawa aktivitas gadget fungsi ponsel
268,https://tekno.sindonews.com/read/683585/776/resmi-diluncurkan-camera-king-huawei-p50-pro-hadirkan-pengalaman-fotografi-profesional-dengan-mudah-mulai-tanggal-11-februari-1644584570,"Gambar Lebih Jernih dengan Super Colour Filter System. Dengan dukungan True-Chroma Camera (Colour) dan True-Chroma (Monochrome), system ini mampu meningkatkan asupan cahaya kamera utama sebesar 103 persen, sehingga pada cahaya rendah sekalipun, foto menjadi lebih cerah dan lebih detail. Bahkan, sistem ini mampu menampilkan detail dan tekstur yang tajam pada pembesaran setiap subyek individu pada foto grup.",gambar jernih super colour filter system dukung true-chroma camera colour true-chroma monochrome system tingkat asupan cahaya kamera utama persen cahaya rendah foto cerah detail sistem tampil detail tekstur tajam subyek individu foto grup
269,https://tekno.sindonews.com/read/673687/776/epson-luncurkan-printer-tekstil-monna-lisa-evo-tre-16-di-bajukertas-co-1643713323,"“Saat ini kan industri fashion bergerak sangat cepat. Kalau dulu produk fashion ini diproduksi per musim, sekarang bisa dua kali dalam sepekan mereka produksi keluaran terbarunya. Otomatis dari sisi produksi kami harus bisa mengikuti tren dan ekspektasi market yang begitu cepat. Produksi secara digital ini menjadi solusi untuk kami,” ujar Yoga. Perangkat lunak Epson Edge Print Textile RIP yang dijalankan pada printer Monna Lisa pun dikembangkan sendiri sebagai bagian dari Total Textile Solution. Hal ini menjadi dukungan holistik bagi pelanggan untuk pra-perawatan, printer, tinta, peralatan insidental, instalasi, dan layanan Epson sendiri.",industri fashion gerak cepat produk fashion produksi musim kali pekan produksi otomatis sisi produksi tren ekspektasi market cepat produksi digital solusi yoga perangkat lunak epson edge print textile rip jalan printer monna lisa kembang total textile solution dukung holistik langgan pra-perawatan printer tinta alat insidental instalasi layan epson
271,https://tekno.sindonews.com/read/655545/776/6-merk-laptop-terbaik-untuk-mahasiswa-harga-murah-spesifikasi-melimpah-1642050071,"4. Laptop Lenovo Yoga C930 Laptop Lenovo Yoga C930 menjadi laptop berikutnya yang masuk dalam jajaran merk laptop terbaik 2022 yang cocok untuk mahasiswa dan juga pelajar. Laptop kelas premium Lenovo ini menghadirkan 3 pilihan mode pemakaian yakni mode tablet garaged pen, mode tent dan mode stand yang dapat diputar 360 derajat. Laptop hybrid pabrikan Lenovo ini dibekali dengan layar Touchscreen sebesar 13.9 inchi full HD 1920 x 1080 piksel atau 4K 3840 x 2160 piksel menjanjikan tampilan layar begitu jernih dan ciamik. Sedangkan sisi kinerja ditopang oleh prosesor Intel core i7 8th Gen, kapasitas RAM jumbo 16GB serta internal memory hingga 2TB SSD. Laptop terbaik Lenovo Yoga C930 memiliki dimensi 32.2 cm x 22.7 cm x 1.45 cm serta bobot yang ringan hanya 1.38 kg yang mudah dibawa kemana saja. Laptop dengan desain mewah, fitur melimpah serta bobot ringan yang perfect untuk para makasiswa dan pelajar masa kini.",laptop lenovo yoga c laptop lenovo yoga c laptop masuk jajar merk laptop cocok mahasiswa ajar laptop kelas premium lenovo hadir pilih mode pakai mode tablet garaged pen mode tent mode stand putar derajat laptop hybrid pabrikan lenovo bekal layar touchscreen inchi full hd x piksel k x piksel janji tampil layar jernih ciamik sisi kerja topang prosesor intel core i th gen kapasitas ram jumbo gb internal memory tb ssd laptop lenovo yoga c milik dimensi cm x cm x cm bobot ringan kg mudah bawa laptop desain mewah fitur limpah bobot ringan perfect makasiswa ajar
272,https://tekno.sindonews.com/read/653809/776/ini-10-tren-teknologi-terdepan-prediksi-alibaba-1641891691,"#8 Perceptive Soft Robotic Tidak seperti robot konvensional pada umumnya, perceptive soft robotic adalah robot dengan tubuh yang fleksibel secara fisik dan kepekaan yang mengalami peningkatan pada tekanan, penglihatan, dan suara. Robot-robot ini memanfaatkan teknologi canggih seperti fleksibel pada elektronika, materi tubuh yang bebas tekanan, dan AI, yang memungkinkan robot-robot itu melakukan aktivitas khusus dan kompleks serta melakukan penyesuain bentuk agar adaptif dengan lingkungan fisik yang berbeda. Kemunculan perceptive soft robotic akan mengubah arah industri manufaktur, dari produksi massal produk terstandarisasi menjadi produk khusus dalam jumlah kecil. Dalam lima tahun ke depan, perceptive soft robotic akan menggantikan robot konvensional di industri manufaktur dan membuka jalan bagi penggunaan service robot yang lebih luas dalam kehidupan sehari-hari.",perceptive soft robotic robot konvensional perceptive soft robotic robot tubuh fleksibel fisik peka alam tingkat tekan lihat suara robot manfaat teknologi canggih fleksibel elektronika materi tubuh bebas tekan ai robot laku aktivitas khusus kompleks laku penyesuain bentuk adaptif lingkung fisik beda muncul perceptive soft robotic ubah arah industri manufaktur produksi massal produk standar produk khusus perceptive soft robotic ganti robot konvensional industri manufaktur buka jalan service robot luas hidup
273,https://tekno.sindonews.com/read/641045/776/asus-expertcenter-desktop-pc-terbaik-untuk-bisnis-1640664747,"Sebagai produsen laptop ternama dengan penguasaan pasar paling tinggi di Indonesia, ASUS memiliki jajaran produk khusus untuk kalangan bisnis dan komersial. Produk bernama ASUS ExpertBook untuk laptop, dan ASUS ExpertCenter untuk PC desktop serta All-in-One (AiO) hadir dengan serangkaian fitur inovatif yang dapat memenuhi semua kebutuhan dalam dunia bisnis. Khusus untuk rangkaian produk ExpertBook dan ExpertCenter juga dilengkapi oleh layanan perlindungan khusus serta dukungan terbaik sehingga memastikan seluruh proses bisnis Anda dapat terus berjalan lancar.",produsen laptop nama kuasa pasar indonesia asus milik jajar produk khusus kalang bisnis komersial produk nama asus expertbook laptop asus expertcenter pc desktop all-in-one aio hadir rangkai fitur inovatif penuh butuh dunia bisnis khusus rangkai produk expertbook expertcenter lengkap layan lindung khusus dukung proses bisnis jalan lancar
276,https://tekno.sindonews.com/read/628343/776/oppo-a95-punya-5-fitur-rahasia-bikin-main-games-makin-lancar-1639487534,"5. Blok Notifikasi. Agar tidak terganggu notifikasi yang masuk saat kita sedang asyik ngegame, pengguna bisa mengaktifkan fitur Block Notification di OPPO A95. Fitur ini akan memblokir notifikasi yang mengganggu. Apalagi saat kita sedang fokus menaikkan rank. Dengan Block Notification, pengguna bisa ngegame dengan nyaman. CM",blok notifikasi ganggu notifikasi masuk asyik ngegame aktif fitur block notification oppo a fitur blokir notifikasi ganggu fokus rank block notification ngegame nyaman cm
278,https://tekno.sindonews.com/read/624421/776/asus-expertbook-b9400-laptop-bisnis-premium-dengan-daya-tahan-baterai-20-jam-1639123972,"Tipis dan Ringan Tanpa Kompromi. Selain ringan, ASUS ExpertBook B9400 merupakan laptop bisnis yang sangat ringkas. Ukuran bodinya lebih kecil dari kertas A4 dan memiliki ketebalan yang tidak lebih dari baterai AA. Bodi ringkas ExpertBook B9400 hadir berkat inovasi yang dihadirkan oleh para ahli di ASUS, sehingga laptop ini tetap dapat digunakan dengan nyaman namun lebih ringkas dari kompetitornya. Satu faktor yang membuat ExpertBook B9400 lebih ringkas adalah bezel layar yang sangat tipis. ExpertBook B9400 mengadopsi NanoEdge Display, yaitu teknologi yang memungkinkan layar memiliki bezel ultra-tipis. Hadir dengan dimensi hanya 32,0x20,3cm yang tentu saja lebih kecil dari sebagian besar laptop sekelasnya yang menggunakan layar 14 inci ExpertBook B9400 memiliki screen-to-body ratio hingga 94%. Ditambah dengan ketebalan hanya 1,49cm dan bobot hanya 880 gram, ExpertBook B9400 dapat dengan mudah serta nyaman dibawa bepergian bahkan menggunakan tas berukuran kecil sekalipun.",tipis ringan kompromi ringan asus expertbook b rupa laptop bisnis ringkas ukur bodi kertas a milik tebal baterai aa bodi ringkas expertbook b hadir berkat inovasi hadir ahli asus laptop nyaman ringkas kompetitor faktor expertbook b ringkas bezel layar tipis expertbook b adopsi nanoedge display teknologi layar milik bezel ultra-tipis hadir dimensi x cm laptop kelas layar inci expertbook b milik screen-to-body ratio tebal cm bobot gram expertbook b mudah nyaman bawa pergi tas ukur
278,https://tekno.sindonews.com/read/624421/776/asus-expertbook-b9400-laptop-bisnis-premium-dengan-daya-tahan-baterai-20-jam-1639123972,"Ditenagai Prosesor 11th Gen Intel Core dan Tervalidasi Intel EVO. ExpertBook B9400 ditenagai oleh prosesor Intel Core 11th Gen terbaru yang hadir dengan performa lebih baik dari generasi sebelumnya. Prosesor generasi terbaru dari Intel tersebut tidak hanya powerful tetapi juga hemat daya, serta telah dilengkapi dengan berbagai fitur modern, seperti dukungan terhadap Wi-Fi 6 (802.11ax) dan Thunderbolt 4. Prosesor 11th Gen Intel Core yang digunakan di ExpertBook B9400 juga telah dilengkapi dengan GPU terintegrasi Intel Iris X? Graphics terbaru. Intel Iris X? Graphics menawarkan performa grafis yang lebih baik tanpa konsumsi daya besar, membuat ExpertBook B9400 powerful bahkan dari sisi grafis. Menemani prosesor 11th Gen Intel Core adalah RAM LPDDR4X berkapasitas 16GB dan penyimpanan berupa NVMe PCIe SSD 3.0 berkapasitas hingga 2TB.",tenaga prosesor th gen intel core tervalidasi intel evo expertbook b tenaga prosesor intel core th gen hadir performa generasi prosesor generasi intel powerful hemat daya lengkap fitur modern dukung hadap wi-fi ax thunderbolt prosesor th gen intel core expertbook b lengkap gpu integrasi intel iris x graphics intel iris x graphics tawar performa grafis konsumsi daya expertbook b powerful sisi grafis teman prosesor th gen intel core ram lpddrx kapasitas gb simpan rupa nvme pcie ssd kapasitas tb
278,https://tekno.sindonews.com/read/624421/776/asus-expertbook-b9400-laptop-bisnis-premium-dengan-daya-tahan-baterai-20-jam-1639123972,"Kombinasi keduanya dipadukan dengan performa prosesor 11th Gen Intel Core membuat ExpertBook B9400 dapat memproses data dan menjalankan berbagai aplikasi penunjang bisnis dengan sangat gesit. ExpertBook B9400 pun dapat diandalkan sepanjang waktu. ExpertBook B9400 juga merupakan laptop yang tervalidasi Intel EVO, yang menandakan bahwa laptop ini memenuhi standar kualifikasi dari Intel sebagai laptop modern. Beberapa persyaratan yang harus dipenuhi oleh sebuah laptop untuk memenuhi validasi Intel EVO di antaranya adalah performa gesit dan responsif ditenagai oleh prosesor 11th Gen Intel Core, memiliki daya tahan baterai minimal 10 jam, serta dilengkapi dengan konektivitas modern seperti Thunderbolt 4 dan WiFi 6. Tentu saja ExpertBook B9400 memiliki semua itu.",kombinasi padu performa prosesor th gen intel core expertbook b proses data jalan aplikasi tunjang bisnis gesit expertbook b andal expertbook b rupa laptop tervalidasi intel evo tanda laptop penuh standar kualifikasi intel laptop modern syarat penuh buah laptop penuh validasi intel evo performa gesit responsif tenaga prosesor th gen intel core milik daya tahan baterai minimal jam lengkap konektivitas modern thunderbolt wifi expertbook b milik
283,https://tekno.sindonews.com/read/601229/776/spektakuler-huawei-watch-gt-3-dengan-harmonyos-menjadi-smartwatch-terlaris-dalam-satu-minggu-pasca-peluncuran-1637061074,"Patrick Ru, Country Head Huawei CBG Indonesia menyatakan produk ini dirancang untuk membuat hidup lebih mudah dan lebih nyaman bagi konsumen, serta membantu mereka mencapai tujuan kebugaran menggunakan data ilmiah. “Pemantauan kesehatan dan kebugaran selalu menjadi salah satu kekuatan inti perangkat wearable kami dan kali ini, Huawei menyediakan peningkatan komprehensif untuk seri GT, dengan tambahan TruSeen 5.0+ yang baru,” kata Patrick Ru.Dengan fitur dan akurasinya, HUAWEI WATCH GT 3 cocok untuk pengguna smartwatch baru dan untuk pengguna dengan aktivitas workout progresif. Dengan data yang tercatat secara akurat di jam tangan pintar ini, pengguna akan semakin termotivasi untuk meningkatkan kinerja latihan serta lebih memahami kondisi tubuh.",patrick ru country head huawei cbg indonesia nyata produk rancang hidup mudah nyaman konsumen bantu capai tuju bugar data ilmiah pantau sehat bugar salah kuat inti perangkat wearable kali huawei sedia tingkat komprehensif seri gt truseen patrick ru fitur akurasi huawei watch gt cocok smartwatch aktivitas workout progresif data catat akurat jam tangan pintar motivasi tingkat kerja latih paham kondisi tubuh
283,https://tekno.sindonews.com/read/601229/776/spektakuler-huawei-watch-gt-3-dengan-harmonyos-menjadi-smartwatch-terlaris-dalam-satu-minggu-pasca-peluncuran-1637061074,"4. Menilai Tingkat Kemampuan Pengguna secara Cerdas. Menurut data fisik dan riwayat lari pribadi pengguna, dikombinasikan dengan tujuan pelatihan dan persyaratan performa, Huawei menciptakan sebuah rencana pelatihan yang dipersonalisasi untuk setiap pengguna. Tidak masalah baik seorang pelari tingkat pemula, atau pelari serius yang sedang mempersiapkan kompetisi, atau hanya pelari biasa yang ingin mempertahankan aktivitas fisik, HUAWEI WATCH GT 3 dapat mengembangkan rencana pelatihan yang ditargetkan secara khusus untuk penggunanya. 5. Rencana Latihan dan Olahraga Berkala. Sebagai perangkat smart wearable, HUAWEI WATCH GT 3 merekam dan menganalisis data latihan pengguna, dan secara cerdas mengidentifikasi periode dasar, periode pengangkatan, periode konsolidasi, dan periode pengurangan sesuai dengan tingkat dan tujuan kemampuan atletik pengguna saat ini. Kemudian disesuaikan intensitas latihan dan secara bertahap meningkatkan volume latihan untuk secara bertahap meningkatkan kemampuan berlari penggunanya.",nilai tingkat cerdas data fisik riwayat lari pribadi kombinasi tuju latih syarat performa huawei cipta buah rencana latih personal orang lari tingkat lari serius kompetisi lari tahan aktivitas fisik huawei watch gt kembang rencana latih target khusus rencana latih olahraga perangkat smart wearable huawei watch gt rekam analisis data latih cerdas identifikasi periode dasar periode angkat periode konsolidasi periode sesuai tingkat tuju atletik sesuai intensitas latih tahap tingkat volume latih tahap tingkat lari
283,https://tekno.sindonews.com/read/601229/776/spektakuler-huawei-watch-gt-3-dengan-harmonyos-menjadi-smartwatch-terlaris-dalam-satu-minggu-pasca-peluncuran-1637061074,"Dengan semua keunggulan yang dimiliki HUAWEI WATCH GT 3, Anda akan mendapatkan jam tangan pintar serbaguna untuk mendukung pelacakan kesehatan sepanjang hari dan meningkatkan performa olahraga serta gaya Anda, jika Anda belum memesan pada periode pre-order, Anda masih dapat kesempatan untuk menikmati penawaran pre-order sekarang hingga 26 November 2021. Untuk informasi lebih lanjut, kunjungi link berikut.",unggul milik huawei watch gt jam tangan pintar serbaguna dukung lacak sehat tingkat performa olahraga gaya pesan periode pre-order nikmat tawar pre-order november informasi kunjung link
286,https://tekno.sindonews.com/read/590474/776/seru-seruan-dengan-oppo-omoji-di-coloros-12-begini-caranya-1636096315,"Untuk user interface-nya sendiri sudah sangat baik dan mudah di-navigasikan. Respons gerakannya mulus, latensinya juga rendah. Adapun semua gerakan dan ekspresi wajah dapat terkover dengan baik. Omoji bisa mengikuti gerakan kepala penggunanya, bahkan saat berkedip, tertawa, tersenyum, dan bergerak ke kiri dan ke kanan. Berikut cara menggunakan Omoji: 1. Buka aplikasi Omoji, 2. Geser layar ke kanan untuk melihat tampilan aplikasi., 3. Sentuh “Create an Omoji”., 4. Silahkan mengubah-ubah Omoji berdasarkan 10 elemen yang disediakan., 5. Setelah selesai, gunakan tombol “Use Emoji”. Atau, jika masih ingin mengutak-atik, sentuh menu “Customize Omoji”., 6. Nah, hasil Omoji tersimpan di galeri, dan bisa langsung dipakai atau dibagikan ke media sosial sebagai profile picture.",user interface-nya mudah di-navigasikan respons gerak mulus latensi rendah gerak ekspresi wajah kover omoji gerak kepala kedip tertawa senyum gerak kiri kanan omoji buka aplikasi omoji geser layar kanan lihat tampil aplikasi sentuh create an omoji silah ubah omoji dasar elemen sedia selesai tombol use emoji utak-atik sentuh menu customize omoji hasil omoji simpan galeri langsung pakai media sosial profile picture
296,https://tekno.sindonews.com/read/546976/776/xiaomi-luncurkan-redmi-10-jagoannya-smartphone-entry-level-dengan-quad-camera-50mp-1632222543,"Pengguna juga dapat dengan mudah membuka serta menutup perangkat berkat side arc fingerprint yang didesain begitu ergonomis. Redmi 10 hadir dalam dua varian yaitu 4GB+64GB dan 6GB+128GB. Penjualan perdana perangkat ini akan berlangsung mulai 22 September 2021 melalui channel penjualan online yakni mi.com serta official store Xiaomi Indonesia di Lazada dan Akulaku serta channel offline di Xiaomi Store, Xiaomi Shop dan juga Erafone. Harga dan Ketersediaan Redmi 10. Spesifikasi Redmi 10. Untuk informasi tambahan tentang Xiaomi, silakan kunjungi: https://blog.mi.com/en/ atau akun resmi Xiaomi Indonesia di Instagram, Twitter, dan Facebook.",mudah buka tutup perangkat berkat side arc fingerprint desain ergonomis redmi hadir varian gb gb gb gb jual perdana perangkat langsung september channel jual online mi com official store xiaomi indonesia lazada akulaku channel offline xiaomi store xiaomi shop erafone harga sedia redmi spesifikasi redmi informasi xiaomi sila kunjung https blog mi com en akun resmi xiaomi indonesia instagram twitter facebook
