content_lemma,labels
finalis free fire master league season iii langsung dapat aman posisi di divisi untuk free fire master league season iv bahkan finalis divisi juga dapat promosi masuk divisi lewat babak play-offs dan division qualifiers yang nanti masih akan lanjut beberapa tim dalam posisi bawah baik dari divisi atau masih harus juang untuk aman posisi mereka atau turun kelas ke divisi pada season tanding ikut,1
night mode di cahaya rendah kualitas foto oppo reno masuk baik bisa lihat dari banding antara mode normal dan night mode pintas memang tidak terlalu beda tapi jika perhati lebih detil lihat bahwa night mode mampu buat gambar sedikit lebih terang banding metode standar ini berkat ai scene enhancement yang tugas untuk mengoptimasi gambar sesuai kondisi cahaya lingkung sekitar tarik mode malam ini juga dapat di aplikasi di kamera selfie mp f hasil bisa lihat dengan night mode aktif baik subyek dan latar belakang lihat jauh lebih jelas dan terang,1
beda honda br-v prestige dan honda br-v prestige dengan honda sensing nah all new honda br-v juga milik dua model top of the line yakni all new honda br-v prestige dan all new honda br-v prestige dengan honda sensing pertama kita lihat dulu fitur-fitur mewah yang ada di all new honda br-v prestige varian ini milik semua fitur model bawah dengan tambah jumlah fitur-fitur baru all new honda br-v prestige milik auto foldable side door mirror dengan led turning signal,1
zte corporation turut partisipasi dalam acara luncur jaring g pertama di indonesia yang adakan telkomsel catat zte corporation adalah usaha global muka sedia solusi teknologi telekomunikasi enterprise dan konsumen untuk internet seluler lalu luncur telkomsel g yang adakan baru ini telkomsel hasil jadi operator seluler pertama yang gelar jaring g di indonesia bagai mitra telkomsel zte dukung luncur ini dengan tampil beberapa skenario guna g rupa patrol robot g dan cloud gaming pada luncur telkomsel g di jakarta,1
fatwa mui tentang sembelih hewan kurban kutip dari mui or id selasa ikut adalah fatwa mui nomor tahun tentang hukum dan pandu pelaksnaan ibadah kurban saat kondisi wabah sakit mulut dan kuku pmk kriteria hewan yang sah kurban hewan yang kena pmk dengan gejala klinis kategori ringan seperti lepuh ringan pada celah kuku lesu tidak nafsu makan dan keluar air liur lebih hukum sah jadi hewan kurban kriteria hewan yang tidak sah kurban hewan yang kena pmk gejala klinis kategori berat seperti lepuh pada kuku sampai lepas pincang tidak bisa jalan dan sangat kurus tidak sah jadi hewan kurban,0
bagai bagi dari komitmen dan upaya biznet hadir layan internet wifi yang cepat dan stabil di lebih banyak area di nusa tenggara timur telah kabupaten manggarai labu bajo kini biznet luas jaring di kota kupang tahun lalu biznet telah laku penandatangan mou dengan perintah kota kupang yang tanda awal kerja sama antara biznet dengan perintah kota pemko kupang tentu luas jaring ini rupa komitmen biznet untuk sedia layan yang dapat penuh butuh masyarakat di wilayah sebut akan koneksi internet wifi yang cepat dan stabil untuk dukung aktivitas dan gaya hidup digital masyarakat serta dukung bangun program smart city yang sedang jalan oleh perintah kupang,1
souvenir yang bisa oleh rupa payung shopping bag premium tumber premium lunch box tire repair kit masker voucher bensin shell nilai rp dan e-money nilai rp lama sedia masih ada cara mudah para langgan hanya perlu tunjuk stnk mobil mitsubishi anda ke counter after sales mitsubishi lama iims yang akan langsung hingga april datang jadi tunggu apa lagi kunjung booth mitsubishi di hall a iims jangan sampai lewat,1
peran dan kualitas guru jadi nomor satu berkat semua itu ada orang pak jokowi yang bisa jadi presiden ada saya yang bisa diri di sini ada mas menteri dan ada kita semua karena guru kata ganjar maka siapa pun yang akan laku bangun lebih dahulu harus bangun didik dan guru yang jadi pegang kunci kualitas buah generasi kata dia,0
bahkan turut dia percaya konsumen hadap transaksi elektronik lebih tinggi di bank daripada dompet digital sementara itu saing juga akan jadi antar bank yang sedia layan qris karena percaya hampir rupa maka antar bank biasa lancar perang promo untuk tiap transaksi dan untuk tiap buka rekening baru via aplikasi papar,1
perintah khusus kemenaker harus lebih tingkat mutu didik banyak diri pusat latih kerja seperti rakamin academy yang sudah percaya atau tunjuk oleh kominfo bagai official partner untuk meng-handle program magang jelas andika rakamin selalu komitmen bantu dan bekal para siswa dan siswi talenta yang niat untuk magang di usaha nama sehingga nanti para siswa-siswi sebut dapat saing dalam dunia kerja sungguh lanjut,1
pada menit ke- benar vfl bochum sempat cetak gol lalu philipp hofmann namun sayang gol itu anulir telah wasit lihat var karena nilai hofmann sudah lebih dulu offside masuk menit akhir babk pertama dortmund kembali cetak gol kali ini moukoko catat nama untuk dua kali lalu tendang kencang dari luar kotak penalti babak pertama akhir untuk unggul dortmund -,0
interkom rupa alat untuk komunikasi yang bisa pasang pada helm umum alat ini pasang di belah kiri kiri helm agar mudah bikers untuk operasi lalu pamer pamer indonesia motorcycle show imos tidak hanya tawar produk sepeda motor baru atau listrik tetapi juga agam aksesoris dukung sepeda motor juga ikut memeriahkan,1
namun tidak jelas divisi usaha mana yang akan pengaruh di tesla musk pecat seluruh tim pr beberapa tahun yang lalu dengan gagas itu mungkin miliarder itu akan singkir tim pr twitter sepakat musk untuk beli twitter masuk buat usaha ambil utang us miliar dolar dari bank arti bahwa twitter akan utang sekitar us miliar per tahun,0
matchday yang selenggara pada jumat malam jadi langkah baru bagi beberapa tim yang telah laku transfer in untuk minggu dua ffml season v divisi misal ses alfaink yang masuk main mereka yang belum main untuk tim ses goboba di ffml season v divisi sesgeday sesbocl sempat tunjuk performa yang fenomenal dengan kumpul poin kill dalam round serta beri mereka booyah di round kombinasi yang apik antara mereka dua hasil baik performa ses alfaink yang tampil kurang maksimal pada minggu kemarin,1
selain itu lanjut arya capai dari sisi serta yang ikut giat ini ada serta atau usaha industri tahan dari negara lama giat langsung pamer indo defence juga turut hadir lebih dari delegasi dari negara saya wakil seluruh panitia indo defence expo dan forum menteri tahan ri dan juga seluruh panitia pt napindo ingin ucap terimakasih yang besar besar kepada seluruh stakeholder yang libat di dalam giat akbar ini kata arya seta,1
apakah red tigers akan mampu bangkit dari salah dan tunjuk performa baik saksi babak knock out esports star indonesia tiap hari sabtu pukul wib jangan lupa untuk follow akun instagram esportsstarindonesia untuk tahu bagai update baru dan tentu saksi konten konten tarik dari esports star indonesia,1
komando militer selatan ukraina tulis di facebook bahwa pada malam hari rusia buru evakuasi sisa garnisun dari pulau itu telah serang oleh unit rudal dan artileri kata juga bahwa pulau itu selimut api dan ledak lalu unggah foto buram yang tampak ad alah pulau dengan kepul asap pul,0
redmi c rekomendasi smartphone rp juta pertama adalah redmi c smartphone yang satu ini baru saja luncur di indonesia dengan bawa layar ukur inci dengan resolusi full hd plus untuk topang giat fotografi redmi c lengkap dengan dua buah kamera belakang yang diri dari kamera utama mp dan kamera depth mp tidak henti di situ hadir pula kamera selfie mp di sektor dapur pacu redmi c andal prosesor qualcomm snapdragon yang padu dengan ram gb dan memori internal hingga gb untuk baterai kapasitas mah dengan isi w harga redmi c gb gb - rp redmi c gb gb - rp,1
coach marsha pun sampai tidak bisa sembunyi rasa senang dan bangga kepada performa baik dari bankai aville aeden maxi dan jbun itu yang gue bilang no mistake perfect di match pertama easy game lima lima mvp main rapi kata coach marsha dengan nada senang sayang gembira ini tidak laku untuk coach nyoong dan coach emperor zeggzy salah satu calon bintang esports asal makassar anggap laku salah fatal tanpa usaha komunikasi dengan baik salah fatal yang buat red tigers pukul telak dan akhir harus terima kalah dari blue rhinos,1
saat ini biznet telah resmi buka dua kantor cabang di kota medan yaitu biznet branch medan sidodadi yang lokasi di jl prof hm yamin dan biznet branch medan simpang tanjung yang lokasi di ruko tomang elok jl gatot subroto dua kantor cabang ini operasi pada pukul wib tiap hari dengan tetap buka layan langgan cara online lalu live chat di website biznetnetworks com dan biznethome net dan lalu telp ke customer care biznet home care atau lalu email ke customer care biznetnetworks com home care biznetnetworks com yang sedia lama jam tiap hari,1
tidak pernah henti tidak hormat bagai aparatur sipil negara tni polri atau institusi lain tidak pernah guna dan atau libat narkoba psikotropika bukti dengan surat terang dari instansi yang wenang sedia tempat di seluruh wilayah kerja usaha yang bukti dengan surat nyata tanda tangan di atas materai rp lama jalan dinas tidak dalam kondisi hamil,1
menteri koordinator bidang politik hukum dan aman menko polhukam mahfud md sampai kenang tentang menteri pendayagunaan aparatur negara dan reformasi birokrasi menpan rb tjahjo kumolo ia sebut tjahjo adalah orang yang selalu penuh siap dalam jalan tugas negara pak tjahjo itu sangat teliti dalam kerja tenang dan sahabat tetapi selalu tepat sehingga selalu well prepared gitu sebut mahfud temu di masjid quba kemenpan rb sudirman jakarta selatan jumat ya untuk siap kalau ada rapat pasti ada bahan yang jelas kemudian ada tuju yang jelas lalu ada alternatifalternatif putus ungkap dia,0
ivan perisic jadi pahlawan inter pada babak tambah bomber kroasia itu buku dua gol sekaligus antar la beneamata ke trofi juara dengan menang - atas juventus ini jadi titel coppa italia delapan inter mil panjang sejarah kali akhir si ular menang gelar coppa italia yakni pada coppa italia rupa trofi dua yang sembah simone inzaghi untuk inter latih tahun sebut belum sukses sabet titel piala super italia pada awal tahun,0
untuk lengkap seri confero yang telah dapat subsidi ppnbm persen dari perintah wuling motors wuling hadir subsidi ppnbm kepada seri almaz rs seri almaz dan juga seri cortez ct yang besar sesuai dengan bijak perintah selain itu wuling juga beri mudah lebih bagi konsumen yang ingin milik almaz dan almaz rs lalu program wuling pay later seluruh program ini laku hanya hingga agustus,1
laptop cakep yang dongkrak produktivitas luncur huawei matebook d dan matebook d th generation jadi bukti dari komitmen kini huawei dalam kuat unggul estetika inovasi dan cerdas bagai dna bagi produk pc yang cipta dari masa ke masa selain itu seri laptop ini juga jawab bagai keluh yang kerap rasa guna jajar laptop di segmen entry-level yang mana hal sebut rangkum dalam rangkai lebih ikut,1
polisi umum telah tangkap bunuh rapper takeoff hal itu umum sekitar satu bulan takeoff tinggal dunia akibat tembak saat hadir acara pesta privat di billiards bowling kepala departemen polisi houston troy finner umum tembak takeoff rupa patrick xavier clark pria usia tahun yang kini telah tangkap dan dakwa atas bunuh sang rapper finner lapor patrick xavier clark tangkap di sisi timur houston texas pada kamis hari telah pria lain cameron joshua dakwa dengan bawa senjata hubung dengan kasus sebut,0
tak hanya itu mudah untuk konsumen dukung agam layan yang mudah konsumen seperti call center mitsubishi motors customer care dan layan siaga mitsubishi jam yang dapat akses konsumen lalu --- juga lalu aplikasi my mitsubishi motors id genuine accessories new xpander dan new xpander cross mmksi sedia genuine accessories new xpander dan new xpander cross bagi guna yang ingin mengkustomisasi kendara mitsubishi motors genuine accessories rancang dan kembang sama dengan kendara mitsubishi untuk integrasi yang sempurna,1
performa mesin paling tinggi tetap irit mesin l dohc i-vtec all new honda br-v bisa sebut baik di kelas tenaga besar banding kompetitor yakni mampu pompa ps pada rpm dengan torsi maksimum nm pada rpm mesin sebut sangat responsif sesuai ciri khas fun to drive yang milik honda cvt juga buat all new honda br-v tetap irit wajar jika mobil sebut nyaman bawa keluar kota atau jalan tanjak sekalipun,1
jika belum orang yang datang psikolog rata mereka yang usia remaja dan dewasa kini justru beda rose aku makin banyak pasien anak yang datang dia cerita milik pasien yang masih duduk di bangku kelas sekolah dasar sd anak sebut datang ke psikolog juga atas mau bukan karena perintah orang tua jadi anak ini minta sama mama ma saya mau konsultasi ke psikolog kata rose tiru ucap anak sebut,0
baik galaxy s g dan s g sedia dalam varian warna phantom black phantom white green dan pink gold dengan opsi memori gb dan gb serta opsi ram gb dengan teknologi ganda dalam perangkat ini tentu saja jadi momen hari valentine jadi lebih kesan samsung care layan yang khusus dukung langgan untuk dapat lindung hadap rusak yang tidak sengaja baik dan lain akan sedia untuk galaxy s g series informasi lebih lanjut tentang galaxy s g dan s g bisa lihat di www samsung com id atau kunjung www news samsung com id,1
travoy hampir sama seperti google maps aplikasi travoy juga tawar fitur peta jalan namun pada aplikasi yang rancang oleh pt jasa marga tbk ini lengkap dengan fitur untuk pantau langsung kondisi jalan tol lewat cctv tidak hanya itu aplikasi travoy juga hadir agam informasi lain seperti informasi rest area dan tarif tol mulai dari golong i hingga golong v aplikasi bisa di download tanpandipungut biaya apa,1
siap upgrade ke windows expertbook b rupa salah satu laptop yang siap dukung windows asus telah bekerjasama dengan microsoft untuk hadir update windows untuk expertbook b cara langsung saat sistem operasi baru sebut hadir cara resmi tidak hanya itu guna expertbook b akan dapat upgrade ke windows tanpa biaya tambah informasi lebih lanjut kena asus expertbook b bisa lihat di url ini,1
mereka yang tinggal di jerman tahu bahwa bom dari perang dunia ii masih sering temu kata scholz kepada wartawan ukraina harus siap diri untuk perang dengan konsekuensi perang ini lama tahun lanjut meski begitu olaf pasti pihak dan negara sekutu akan bantu ukraina untuk bangun kembali negara sebut itu mengapa kita juga harus kerja sama dalam rekonstruksi imbuh,0
saya rasa hormat bisa banding dengan dia jason momoa yang rupa aktor luar biasa manusia fantastis dia adalah bintang hollywood dan orang banding saya dengan dia kata tenoch huerta kepada rolling stone via comicbook saya seperti ya ampun ma mereka bicara saya dan jason itu luar biasa saya suka ucap tenoch huerta,0
oppo a jadi salah satu ponsel paling tangguh di harga rp juta oppo sudah jalan rangkai tes uji daya tahan dengan sangat ketat sehingga build quality-nya sangat baik dan bisa tahan bagai kondisi ekstrim nah ikut adalah beberapa tangguh oppo a,1
album dari sextet jebol sekolah seni institut seni jakarta ini inspirasi untuk buat soundtrack buah film pada album yang isi sebelas lagu dengan aransemen yang lebih rumit dapat rasa wsatcc sedang eksperimen meski begitu mereka rasa sedang bersenangsenang pada album yang satu ini,1
cara hindar hepatitis akut bagaimana sih ingat sakit sebut belakang tengah bikin geger masyarakat lantar kasus yang terus tambah dasar data baru dari menteri sehat kemenkes ri catat ada kasus duga infeksi hepatitis tujuh di antara tinggal dunia jadi yang tinggal ada empat dari dki jakarta dari sumatera barat kalimantan timur dan jawa timur tutur dr nadia saat hubung detikcom kamis,0
hal itu yang buat warga sekitar hormat pada meski tegas pakde tjahjo kumolo itu dia tak tega kata dia dia tutur rumah yang dia tempat rupa rumah tjahjo kumolo sejak kecil hingga lulus kuliah saat ini rumah sebut dia tempat dengan adik ipar tjahjo kumolo yang rupa orangtua adrin yang adik kandung pakde itu ibu saya sudah tinggal ucap dia ingat tjahjo kumolo akhir pulang ke rumah di kota sarang satu bulan yang lalu rumah sebut biasa guna untuk terima tamu dan temu keluarga satu bulan yang lalu seperti pakde pulang ke sini ungkap dia benar dia sudah dengar jika tjahjo kumolo rawat di rumah sakit lama beberapa minggu,0
kuat kapabilitas digital untuk konektivitas yang prima bagai connectivity enabler telkomsel komitmen untuk terus gerak maju dalam luas cakup jaring broadband depan di seluruh penjuru negeri lalu upaya kuat dan rata jaring bagi tiap lapis masyarakat komitmen sebut telah aktualisasi telkomsel dengan gelar infrastruktur jaring rupa lebih dari base transceiver station bts sampai dengan maret yang jangkau persen wilayah populasi indonesia,1
selain itu andi tambah giat tri dharma guru tinggi harus terus tingkat kualitas dan kuantitas ini jadi bagi dari komitmen universitas mercu buana dalam rangka ikut cerdas dan siap generasi bangsa yang didik dan budi pekerti baik dalam acara silaturahmi dan temu guru besar umb sebut hadir antara lain prof dr ir chandrasa soekardi dea prof dr masydzulhak djamil mz se mm prof said djamaluddin mm ph d prof dr wiwik utami ak ms ca cma csrs prof dr apollo msi prof dr f sarwono hardjomuljadi m sc m h prof dr djumarno mba prof dr ir m noor salim se mm prof dr usman sudjadi m sc dan prof ir bambang heryanto m sc ph d saat ini umb telah kantong akreditasi unggul badan akreditasi nasional guru tinggi ban-pt akreditas unggul adalah level tinggi yang beri oleh ban-pt kepada guru tinggi,1
dengan baik sebut kurang bocor air sekitar meter kubik per hari yang cukup untuk pasok air keran tambah ke lebih dari warga kota sukabumi kholik jelas teknologi yang kembang yakni dengan guna cerdas buat dan teknologi cloud serta sistem manajemen bocor air kurang bocor lokal yang laku seperti latih tingkat kapasitas sumber daya manusia dan terap platform manajemen bocor air dan bangun sistem untuk salur air sukabumi,0
fitur yang tawar pun sesuai standar buah mpv premium saat tunggang kendara ini kesan mewah canggih dan elegan sangat rasa lihat saja konsep kabin staria layak buah lounge yang nyaman dan mewah ini lihat dari tampil jendela panoramic di kursi baris dua bahkan di kursi baris dua dan tiga untuk privasi tumpang lengkap tirai yang dapat buka dan tutup cara manual,1
puan kata megawati kemudian instruksi kepada seluruh kader pdip kait tinggal tjahjo salah satu instruksi itu adalah kader pdip minta antar tjahjo ke makam tugas kita semua kader pdip untuk bisa antar pak tjahjo ke tempat persamayaman akhir ucap,0
zipmex salah satu platform aset digital dengan tumbuh tinggi di asia pasifik kolaborasi dengan komunitas kaiju kingz selenggara gathering pertama bagi milik nft kaiju kingz di indonesia gathering kolaborasi komunitas milik nft kaiju kingz dan zipmex adakan pada mei lalu di kilakila by akasya acara yang adakan untuk pertama kali di indonesia ini hadir cara eksklusif oleh orang milik nft kaiju kingz dari indonesia dan singapura,1
dalam foto yang unggah itu moka fang lihat sedang pose di buah kapal pesiar dan kena kacamata hitam topi coklat serta baju renang dengan renda warna putih tidak ada yang salah dengan pose namun netizen rasa baju itu terlalu begitu minim kena sehingga bagi tubuh lihat sangat ekspos sementara itu beberapa netizen lain juga ada yang masih puji cantik dari ibu dua anak ini moka fang memang kenal milik wajah yang cantik meski demikian hal itu tidak tutup mungkin dapat orang yang benci netizen yang kritik itu rasa pakai moka fang harus bisa lebih tutup karena foto bagi di internet ini lihat tidak pantas tulis orang netizen di kolom komentar kutip dari days,0
media itu pun seru masyarakat internasional untuk minta pertanggungjawaban pasuk duduk israel atas target dan bunuh yang sengaja hadap jurnalis perempuan sebut dalam nyata pisah menteri sehat palestina nyata bahwa orang wartawan palestina lain juga tembak dengan peluru tajam di punggung jurnalis sebut ali samoudi yang kerja untuk surat kabar quds yang basis di yerusalem lapor dalam kondisi stabil,0
ffml season iv divisi - match day ronde muda dan nesc esports ronde kalahari dan echo esports ronde purgatory dan echo esports ronde muda dan nesc esports ronde kalahari dan echo esports ronde purgatory dan bigetron bit ffml season iv divisi - match day ronde muda dan evos immortal ronde kalahari dan rosugoesports ronde purgatory dan g arsy esports ronde muda dan g arsy esports ronde kalahari dan ses goboba ronde purgatory dan rosugo esports,1
jenazah menteri pendayagunaan aparatur negara dan reformasi birokrasi menpanrb tjahjo kumolo tiba di taman makam pahlawan tmp kalibata jakarta selatan jumat sore tjahjo tinggal dunia di rumah sakit abdi waluyo jakarta pusat sekitar pukul wib dasar pantau kompas com mobil yang bawa jenazah tjahjo tiba di makam pukul,0
mereka pindai bagasi kemudian panggil saya untuk lihat lalu koper - mereka kata mereka tidak bisa buka sampai saya tiba di sana - dan kami habis waktu lama untuk temu akhir saya temu ecclestone kemudian lanjut dengan kata bahwa taktik mercedes di abu dhabi buat lewis hamilton catat rekor juara dunia delapan,1
dia kata rumah dengan dominasi warna merah itu rupa rumah keluarga yang tempat tjahjo kumolo sejak kecil hingga lulus kuliah biasa pakde tjahjo kumolo bawa tamu ke sini kata dia saat ini rumah sebut dia tempat dengan adik ipar tjahjo kumolo yang rupa orangtua adrin yang sedang derita stroke yang adik kandung pakde itu ibu saya sudah tinggal ucap dia benar dia sudah dengar jika tjahjo kumolo rawat di rumah sakit lama beberapa minggu,0
smartwatch ydz smartwatch ydz milik tampil desain yang keren dan stylish smartwatch ini milik layar inci dan sedia fitur basic komunikasi seperti sms dan panggil serta milik fitur sport tracker untuk harga smartwatch yang satu ini juga cukup murah yaitu rp saja,1
bagai promo tarik yang tawar ini rupa diskon mulai dari hingga untuk beli aksesoris maupun suku cadang di antara diskon untuk beli paket genuine accessories new xpander bagi konsumen yang laku beli new xpander di event iims diskon ini laku untuk seluruh paket genuine accessories mitsubishi kecuali safety paket aksesoris sebut rupa interior basic safety airdam aero aero plus platinum,1
steady video untuk rekam video oppo a milik mode steady video serta slow slo-mo p pada fps oppo sudah benam teknologi electronic image stabilization eis dengan software untuk redam getar ketika potret atau rekam video resolusi video capai p atau p di fps eis pada a guna sensor khusus untuk deteksi gerak interpretasi kemudian baik frame per frame cara otomatis sehingga gambar dan video yang hasil lihat lebih tajam stabil sementara kamera depan pakai sensor mp dengan fitur ai beautification untuk beri efek cantik kulit yang lebih alami,1
ketua umum pdip megawati soekarnoputri terus pantau kondisi tjahjo presiden joko widodo juga turut besuk tjahjo tak lama telah tjahjo bawa ke rumah sakit tjahjo makam di taman makam pahlawan tmp kalibata jakarta,0
lewat milu tjahjo kembali pilih bagai anggota dewan kala itu dia tunjuk jadi wakil sekretaris fraksi pdip tjahjo lagilagi pilih bagai anggota dpr ri lewat milu lalu milu saat itu dia jadi anggota komisi i dpr yang bidang tahan luar negeri dan informasi dalam periode yang sama tepat tahun tjahjo percaya jadi ketua fraksi pdip di parlemen ketua umum pdip megawati soekarnoputri tampak senang dengan kerja tjahjo bukti karier di internal partai terus tanjak telah percaya bagai ketua dewan pimpin pusat dpp bidang politik pdip di tahun cara kejut tahun tjahjo beri amanat megawati untuk jadi sekretaris jenderal sekjen partai jabat itu tjahjo emban lama tahun hingga belum akhir ganti oleh hasto kristyanto,0
salah satu komponen penting kendara adalah battery atau aki aki milik fungsi sangat vital fungsi sebut di antara hasil arus listrik yang aktif komponen elektrikal starter lampu klakson speedometer dan fitur elektrik lain karena fungsi yang begitu vital baik kendara mesti benar hati kondisi aki agar kendara dapat fungsi cara optimal dalam dukung mobilitas hari,1
sementara itu yayasan daya digital telah capai terobos dalam hal ubiquitous broadband pervasive computing multi-dimensional convergence dan green energy saving yang mungkin interaksi cara real-time aplikasi yang gesit dan inovatif efisiensi sumber daya cara maksimal dan kembang lanjut usaha sedia untuk buka mampu dasar ini kepada semua mitra industri dan ekosistem untuk rangkul masa depan yang saling untung ikut adalah pidato dari xu ziyang ceo zte corporation selamat pagi selamat siang dan selamat malam hadirin yang saya hormat rupa hormat bagi saya untuk partisipasi dalam acara mwc barcelona cara virtual mana sangat beda dengan belum saya akan bagi tentang dorong digitalisasi dengan teknologi cerdas yang bawa harap sama dengan mitra kami di ekosistem untuk temu jalan bagi transformasi digital dan cerdas dengan terus kuat fondasi digital,1
oppo a sendiri bawa layar besar inci dengan screen-to-body ratio dan resolusi fhd x layar ini juga hadir ntsc wide color gamut dan sudah dukung refresh rate hz untuk urus fotografi oppo a bekal dengan dua kamera belakang yang diri dari kamera utama mp dan kamera bokeh mp tidak henti di situ semat juga kamera depan resolusi mp,1
oppo find x pro pilih smartphone oppo dengan kamera belakang lanjut ialah oppo find x pro yang milik warna klasik yang elegan guna chipset qualcomm smartphone ini rupa salah satu smartphone oppo kelas premium yang milik banyak unggul salah satu ialah kamera belakang yang milik resolusi tinggi yakni mp mp mp ultrawide ram dari smartphone ini juga cukup besar yakni pilih gb gb dan gb dengan memori internal gb dan gb sehingga bisa simpan banyak media dan guna banyak aplikasi smarpthone ini milik kapasitas baterai mah dengan fitur fast charging w,1
