content_lemma,labels
akhir dalam temu juga bahas kena banding bijak uang indonesia dengan banyak negara turut erick hal itu laku agar indonesia bisa lebih kompetitif dan bisa terus jaring investasi supaya kita bisa lebih kompetitif dan terus jaring investasi bagai tumbuh lapang kerja dan tentu ekonomi indonesia yang hari ini sangat tumbuh baik dan semua negara apresiasi itu tamnahnya,0
faktor tunjang nyaman selain ac yang dingin ada beberapa fitur tunjang nyaman yang rasa tumpang di baris dua atau tiga misal konsol sandar tangan dan tempat botol air penting untuk jaga tidak dehidrasi dalam jalan panjang atau mudah juga untuk letak kopi atau boba outlet listrik yang sedia di depan area konsol kursi baris dua dan baris tiga sudah pasti buat anak tidak rebut untuk isi daya ponsel atau tablet mereka,1
untuk pasti fungsi dan ke andal produk mmksi akan pulai uji coba dengan mitra potensial di indonesia untuk operasional mereka hasil uji akan guna untuk kembang kendara listrik mitsubishi motors di indonesia serta kontribusi pada tumbuh lanjut dari mitra kami dan juga masyarakat tidak hanya hadir produk baru mmksi juga bawa inovasi baru yaitu mira mitsubishi virtual assistant yang akan bantu konsumen untuk dapat informasi produk serta layan mitsubishi motors salah satu kendara yang tampil di giias adalah mitsubishi new xpander,1
nato resmi undang ke swedia dan finlandia untuk gabung dengan aliansi pada rabu ini jadi buah ekspansi sejarah dari blok tahan yang cara langsung lemah tuju presiden rusia vladimir putin saat perang di ukraina lanjut lansir cnn kelompok sebut cara kolektif putus untuk tuju aplikasi negara untuk gabung telah turkiye cabut berat pada hari selasa buka jalan bagi luas paling penting nato dalam beberapa dasawarsa,0
polisi negara repubik indonesia polri tengah proses tinjau kembali atas putus kode etik hadap akbp raden brotoseno adapun brotoseno rupa polisi yang telah bukti laku tindak pidana suap namun tidak pecat kepala biro terang masyarakat karo penmas divisi humas polri brigjen ahmad ramadhan kata komisi kode etik polri tinjau kembali kasus brotoseno akan kerja lama hari yang jelas sejak bentuk komisi tinjau kembali kembali sejak tanggal juni kemarin beri waktu hari ya telah waktu hari maka komisi harus sampai hasil periksa kata ramadhan di the tribata dharmawangsa jakarta jumat,0
saat konsultasi anak ini rasa sulit curhat atau minta dapat kepada orang sekitar anak ini rasa lebih aman jika laku sesi konsultasi dengan psikolog tentu ini bagus ya karena lama ini anak itu tahan mereka tidak mau cerita dan tahan sendiri ujung depresi tapi kalau dia sudah aware mental bisa lebih stabil kata rose,0
lihat terima sangat positif dari kunjung pada booth mitsubishi motors pihak selenggara iims anugerah harga most interactive booth kepada mmksi pada seremoni tutup pamer kami apresiasi antusiasme konsumen yang tinggi hadap brand dan model mitsubishi motors di indonesia utama pada ajang iims mana kami ingin sosialisasi kembali konsep branding baru life adventure serta tingkat kualitas dan agam layan mitsubishi motors di indonesia cara lebih luas lagi kepada masyarakat guna pasti konsumen dapat alam baik kait manfaat produk serta mudah layan pada seluruh proses milik kendara ungkap naoya nakamura president director pt mmksi,1
tahu model ini diri dari beberapa varian yaitu benly e i dan i pro lalu benly e ii dan ii pro empat varian ini beda dari motor listrik serta jarak tempuh untuk mesin kuda besi ini gendong motor listrik kw serta torsi newton motor dan bisa tempuh sampai jauh km dua datang dari model honda gyro e motor listrik ini memang sasar pasar kendara niaga untuk butuh bisnis komersial dan juga layan antar atau kurir unik honda tetap tahan konfigurasi tiga roda dengan dua roda di bagi belakang bicara soal baterai model ini sudah usung teknologi mobile power pack yang bisa diswap mesin ini mampu milik tenaga tara daya kuda dengan torsi newton meter yang tenaga dua buah baterai v yang mampu tempuh jarak jauh km,0
di grup b sendiri tanding lihat dominasi tim kuat yang asal dari ffml season v baik divisi maupun namun tampil dari tim komunitas pada group b juga tak bisa lewat begitu saja sebut saja timbdt dan qwerty yang tampil apik dan curi perhati tarung malam ini langsung dramatis pasal bangkit tim dragon phoniex di round akhir dengan belas poin kill dan kali booyah turut ujung pada skenario tak duga mereka harus too soon di round akhir akhir madura prime esports yang dapat booyah di round akhir sukses pasti lolos ke play-ins ffim springs dengan poin sakit hati paut poin saja dengan dg esports dan dranix esports yang hampir saja laku miracle run,1
dyandra promosindo wujud pamer iims virtual februari dengan kuat sinergi dan manfaat teknologi digital kini dengan fokus branding transaksi interaksi atraksi dan bahkan atur test drive and ride ujar presiden direktur dyandra promosindo hendra noor saleh jauh ini dyandra promosindo hadir apm kendara roda empat muka di indonesia di antara yaitu bmw dfsk honda hyundai kia mazda mg mini mitsubishi toyota prestige wuling motors dan brand x,1
iring kembang teknologi di zaman sekarang ini tentu kita tak lepas dari giat cetak berkas untuk perlu tentu seperti dokumen kantor dokumen sekolah dan lain bagai agar aktivitas kerja makin produktif tentu kita butuh perangkat yang canggih serta mumpuni untuk selesai segala kerja dengan cepat kerja dari rumah atau kantor kini anda tak perlu khawatir lagi karena brand nama asal jepang brother tawar solusi jitu yang untung untuk tunjang segala kerja,1
di wawancara pisah lurah tanah tinggi sunardi ungkap bahwa jajar pernah laku sosialisasi yang wakil lembaga musyawarah lurah lmk dan rw pada tingkat camat pada saat sosialisasi itu ada di camat forum itu wilayah wakil tokohtokoh saya dari lurah damping ada lmk dan rw ujar sehingga komunikasi sebut kata sunardi tidak lanjut sampai ke lapis masyarakat,0
pihak saat ini masih terus dalam dua kasus celaka sebut ketua rw tempat aan tutur korban kena seragam buah operator ojol tampak ia akan antar makan karena di motor temu bungkus makan kata aan,0
general manager changhong it indonesia li jian kata kembang teknologi yang makin canggih tentu beri dampak positif salah satu pada aktivitas giat bersih yang kini makin mudah dan cepat dengan hadir robot vacuum cleaner dengan begitu masyarakat tidak perlu lagi repot sapu karena sudah ada robot vacuum cleaner baru dengan bagai fitur inovatif cerdas dan tentu dengan desain yang fleksibel ujar li jian dalam acara midea robozone launch di di por que no menteng jakarta pusat,1
desain premium dan beri nyaman jam di depan layar untuk tunjang rasa percaya diri dan tingkat semangat untuk lebih produktif tak dipungkiri kita butuh buah perangkat dengan desain yang premium dan apik huawei matebook d dan d buat dari bahan aluminium yang kokoh sekaligus elegan berkat poles varian warna cantik dan usung bezel ultra-tipis mm yang mungkin untuk tampung ukur layar lebih besar dalam bodi laptop yang ringkas guna beri sudut pandang tampil lebih luas,1
sedang untuk beli suku cadang dapat diskon untuk mitsubishi motors genuine oil engine oil lalu potong harga pada beli battery aki dan diskon hingga tiap beli ban dari dunlop atau bridgestone untuk model xpander xpander cross dan pajero sport tidak hanya diskon coating package nilai rp pun bisa oleh cara gratis dengan laku beli fleet service package untuk model triton l xpander dan pajero sport,1
untuk tahu pemprov dki jakarta resmi segel outlet holywings pada selasa kemarin segel sebut imbas pada karyawan holywings yang juga harus henti kerja,0
kemudian oppo a bekal dengan baterai kapasitas mah juga sudah dukung teknologi isi daya cepat w supervooctm dengan dukung teknologi isi baterai sebut oppo a dapat isi persen dalam waktu menit dan isi penuh hingga persen hanya dalam waktu satu jam tarik baterai oppo a ini bisa beri pasok daya untuk whatsapp lama jam streaming youtube jam dan dengar musik hingga jam,1
di camat pakenjeng tepat di desa tanjungya banyak satu rumah dampak kemudian di desa jatiwangi satu rumah dampak dan satu sekolah dampak bagi dapur lanjut di camat cikelet tepat di desa cigadog lapor satu rumah dampak lanjut di camat selaawi tepat di desa putrajawa banyak satu rumah dampak,0
dua ada kepala polisi daerah kapolda gorontalo irjen akhmad wiyagus dengan katagori polisi integritas ia nilai bagai sosok yang antisuap akhir kategori polisi inovatif raih wakil kepala polisi daerah wakapolda papua brigjen eko rudi sudarto eko terap noken atau tas asli papua bagai alat untuk tampung tiap saran minta hingga keluh warga tempat kemas binmas noken ini jadi fasilitas untuk bangun interaksi masyarakat antara polri dan rakyat papua kata eko,0
iespa dukung penuh dan apresiasi helat ffml season iv dan ffim fall kami akan dukung penuh para atlet indonesia utama di kancah internasional harap para atlet indonesia dapat laga dengan maksimal di helat internasional seperti sea games yang akan gelar di tahun depan ucap selain dua lembaga sebut selenggara rangkai turnamen free fire fall season turut dukung oleh nabati selaku sponsor utama ian danarko marketing manager nabati turut ungkap rasa bangga dapat beri support di resmi turnamen free fire besar ini,1
halo bca rupa layan bantu serta layan produk untuk nasabah dan non nasabah bca yang dapat akses kapan saja adapun layan customer-service halo bca ini dapat lalu bagai kanal nasabah atau non nasabah bca dapat guna layan halo bca ini mulai dari call center whatsapp sampai media sosial dengan halo bca ini masyarakat dapat tanya lapor atau bahkan sampai keluh kait produk sampai rekening bca nah ikut daftar kontak resmi halo bca yang dapat akses masyarakat,1
telah lima minggu lewat fase liga regular season tim esports di free fire master league ffml season iii akhir sampai di titik rebut akhir yakni babak final babak final divisi akan gelar pada tanggal - februari dan babak final divisi pada tanggal - februari langkah dari tim esports profesional yang juga rupa juara musim lalu aura esports evos esports dan onic olympus tantang untuk tunjuk taring serang balik di minggu final,1
wakil presiden ma ruf amin tampak hadir di kantor menteri pendayagunaan aparatur negara dan reformasi birokrasi kemenpan-rb untuk salat jenazah menpan-rb tjahjo kumolo jumat sore dasar pantau kompas com ma ruf tiba damping oleh menteri rencana bangun nasional suharso monoarfa pukul wib tak lama telah ma ruf lihat gubernur dki jakarta anies baswedan yang datang layat sama istri,0
salah satu pt surya motor shelmindo sms yang jual helm dari harga murah hingga mahal di imos lalu helm merek njs mereka tawar model baru dengan kualitas baik di pasar otomotif indonesia bagi yang hendak cari helm murah mereka tawar harga yang cukup tarik untuk nx benda lindung kepala ini hanya banderol rp ribu saja hal itu ungkap langsung oleh salah satu tenaga jual di sana kalau cari helm murah kami tawar model nx macam helm retro yang cocok untuk motor klasik kami jual helm sebut harga rp ribu ujar salah satu tenaga jual yang enggan sebut nama kepada viva sabtu november,1
selain itu bila banding dengan negara yang lapor xbb ada yang baru alam tingkat namun bagi besar sudah alam turun contoh singapura yang sempat capai ribu per hari kini angka sudah -,0
saat ini guna zipmex juga dapat dapat bonus dari aset kripto hingga persen per tahun dengan simpan aset mereka dalam fitur zipup guna zipup dapat laku deposit maupun tarik dana kapan saja tanpa ada minimum jumlah dan biaya selain itu guna zipmex juga dapat nikmat transaksi bebas biaya pajak panjang bulan juni dan bebas biaya transfer dari exchange lain ke zipmex besar rp ribu yuk tonton seru video gathering pertama kaiju kingz di indonesia di bawah ini,1
pusat lapor dan analisa transaksi uang ppatk juga sempat nyata bahwa mereka telah blokir jumlah aset kripto indra dengan nilai rp miliar dalam kasus binomo ini polisi juga telah tetap tujuh sangka mereka adalah indra kenz selaku afiliator fakar suhartami pratama atau fakarich bagai afilitator sekaligus guru dari indra kenz manajer binomo di indonesia brian edgar nababan dan admin indra wiki gatot tutur mereka jerat dengan pasal sebar berita bohong lalu media elektronik tipu dan cuci uang sidik telah periksa orang saksi dan ahli,0
jelas smp baik swasta maupun negeri yang ikut ppdb online ada sekolah dan yang penuh kuota banyak sekolah untuk sekolah kurang murid dengan rincian sekolah negeri dan sekolah swasta jalur terima ppdb lalu zonasi besar persen prestasi persen afirmasi persen dan pindah orang tua persen bagi besar sekolah yang kurang murid sekolah swasta kata tijan,0
inggris akan beri miliar pound miliar dollar as lagi dalam dukung militer ke ukraina karena nato telah cap rusia bagai ancam langsung besar bagi aman barat nato tuju paket bantu uang dan militer jangka panjang untuk modernisasi bagi besar militer ukraina era soviet,0
kapasitas baterai yang guna mah dengan isi daya cepat kabel w perangkat dapat juga isi cepat tanpa kabel w dan reverse wireless charging w pada bagi belakang milik tiga kamera yaitu kamera lebar mp f ada juga telephoto mp ois dan ultra lebar mp mampu video k fps p fps gyroeis p fps gyroeis hdr sedang pada kamera depan mp f m under display dengan mampu video k fps p fps gyroeis,1
selain itu lanjut arya capai dari sisi serta yang ikut giat ini ada serta atau usaha industri tahan dari negara lama giat langsung pamer indo defence juga turut hadir lebih dari delegasi dari negara saya wakil seluruh panitia indo defence expo dan forum menteri tahan ri dan juga seluruh panitia pt napindo ingin ucap terimakasih yang besar besar kepada seluruh stakeholder yang libat di dalam giat akbar ini kata arya seta,1
biznet hasil tahan peringkat atas bagai provider fixed broadband internet cepat hal ini putus dasar speed score tinggi yaitu poin speedtest intelligence sendiri rupa buah platform uji cepat koneksi internet pihak kembali umum dan keluar daftar usaha sedia fixed broadband internet cepat di indonesia yang laku oleh ookla untuk periode q lalu halaman https www speedtest net global-index indonesia fixed,1
belum salur adu bisa sampai cara daring lalu situs web bappebti www bappebti go id pengaduanonline sejak bappebti juga telah sedia layan informasi untuk masyarakat antara lain sms dan whatsapp center di nomor susul ada sistem resi gudang mobile uji profesi info komoditas adu on line pijin on line di bidang dagang jangka komoditi didid tambah untuk sampai informasi yang lebih luas dan lengkap masyarakat juga dapat sampai lalu e-mail humas bappebti kemendag go id,1
ganjil genap terap tiap hari senin-jumat pada pagi pukul - wib dan sore hari pukul - wib kecuali sabtu-minggu dan libur nasional ada ruas jalan di dki jakarta yang terap atur ganjil genap ikut daftar ruas jalan terap ganjil-genap di dki jakarta jalan mh thamrin jalan jenderal sudirman jalan sisingamangaraja jalan panglima polim jalan fatmawati dari simpang jalan timun sampai jalan tb simatupang jalan tomang raya jalan jenderal s parman jalan gatot subroto jalan mt haryono jalan hr rasuna said jalan di pandjaitan jalan jenderal a yani jalan gunung sahari,0
pantau detak jantung huawei watch gt hadir teknologi pantau detak jantung huawei truseentm yang benar baru dengan adopsi delapan fotodioda dalam tata letak lingkar dua sumber cahaya dari chip yang keluar cahaya lalu -in- lensa led ragam salur untuk terima sinyal cahaya dan desain lengkung untuk wujud penetrasi cahaya yang lebih baik konsumsi daya yang lebih rendah serta alam pakai yang lebih nyaman tempat dual-band five-system gnss juga beri guna posisi lokasi geografis yang lebih akurat,1
akses finlandia dan swedia akan buat mereka lebih aman nato lebih kuat dan kawasan euro-atlantik lebih aman aman finlandia dan swedia sangat penting bagi aliansi masuk lama proses akses kata nyata itu putus itu sekarang akan serah ke parlemen dan legislatif negara anggota untuk ratifikasi akhir para pimpin nato kata mereka harap proses untuk gerak cepat mungkin akses cepat yang belum pernah jadi belum dan tunjuk satu lawan putin para pimpin masuk bicara hari rabu yang dorong menang diplomatik telah turkiye cabut berat hadap dua negara yang gabung dengan nato,0
informasi peristiwa korban terkam buaya terima tim komunikasi basarnas jambi dari terang warga desa kuala dendang orang pria atas nama nuryanis terkam buaya ketika pancing sama dua rekan guna perahu insiden itu jadi pada jumat sekitar pukul wib di di mana korban sama dua rekan sedang pancing di sungai dendang dengan guna perahu ketek saat terkam buaya itu jadi kondisi air sungai dalam ada naik atau pasang perahu yang tumpang nuryasin dan dua rekan cara tiba serang buaya yang kemudian tarik korban ke dalam sungai,0
turnamen aov international championship arena of valor juga bakal gelar turnamen aov international championship di turnamen ini nanti tim dari bagai regional akan saing rebut hadiah besar us juta atau lebih dari rp miliar aov international championship sendiri rupa gelar turnamen aov tahun yang selenggara oleh tencent games dan garena turnamen ini bahkan tidak kalah gengsi banding turnamen moba mobile seperti horizon cup dan m world championship,1
ia jelas aktivitas vulkanik gunung ile lewotolok alam tingkat dari periode amat pukul wita- wita dengan tinggi kolom abu meter stanislaus ingat agar masyarakat sekitar tidak laku aktivitas di dalam radius kilometer dari puncak radius kilometer untuk sektor tenggara radius kilometer untuk sektor timur dan timur laut masyarakat tiga desa yakni lamawolo lamatokan dan jontona agar selalu waspada potensi ancam gugur lava pijar dan awan panas dari bagi timur puncak,0
kupang memang jadi salah satu fokus biznet dalam strategi luas jaring di akhir bagai ibu kota provinsi nusa tenggara timur yang jadi kota sentral tentu kota kupang harus milik sedia infrastruktur utama dalam jaring komunikasi dan koneksi internet untuk terus maju kota ini dalam segala sektor saat ini jaring biznet telah sedia di beberapa wilayah di kota kupang masuk di lurah fatubesi lurah fatululi lurah kayu putih lurah kelapa lima lurah kolhua lurah maulafa lurah nefonaek lurah nunleu lurah oebobo lurah oebufu lurah oesapa barat lurah oepura lurah oeba lurah pasir panjang lurah tuak daun merah,1
dengar musik atau streaming film oppo enco buds yang banderol rp ribu ini milik driver dinamis diameter mm yang cukup besar di kelas oppo sendiri juga pede sebut tws ini milik suara hd dengan kuat di bass hasil kagum sound engineer-nya pintar dalam menterjemahkan aransemen sehingga hasil sound suara yang pas untuk lagu cara teknis suara bass drum yang buat tight dan deep sangat rasa lalu frekuensi - hz yang ingin tonjol juga rasa,1
acara yang rupa kerja sama mnc portal indonesia inewstv dan xl prioritas ini bisa saksi cara live streaming di okezone com channel youtube mnc portal indonesia dan inews tv agar tidak penasaran lagi ikut highlight digiup fest yang jalan lama tiga hari turut hari pertama oktober acara langsung lama pukul - wib acara pandu oleh host shafira umm dan buka dengan performance dari eva celia musisi muda bakat yang pasti sudah tidak asing lagi putri sophia latjuba dan indra lesmana ini kenal dengan karakter vokal yang merdu nan lembut dan pasti akan hibur jelang acara selain tampil hibur dengan aksi panggung yang selalu pukau eva juga akan teman kamu bincang santai bareng narasumber prita hapsari ghozie pakar financial planner financial educator public speaker tulis dan juga dosen feb-ui dengan tema generasi digital melek investasi,1
menteri pendayagunaan aparatur negara dan reformasi birokrasi menpan rb tjahjo kumolo rupa pribadi yang tegas dan suka bantu di mata keluarga keponakan tjahjo kumolo adrin rachmatsyah kata tiap bulan dia selalu bantu cara finansial oleh tjahjo kumolo saya tak bisa sebut nominal yang jelas tiap bulan selalu beri kata adrin saat temu di rumah tjahjo kumolo di jalan citarum kota sarang jawa tengah pada jumat selain suka bantu tjahjo kumolo rupa orang yang tak tega lihat orang di sekitar hidup susah,0
beberapa tahun akhir istilah rumah pintar atau smart home makin santer dengar hal sebut iring dengan kembang inovasi teknologi yang makin bawa praktis salah satu dalam urus rumah seperti nama smart home rupa tempat tinggal yang basis teknologi sehingga semua alat rumah dapat atur dan kendali dari jarak jauh maupun dekat,1
giat tambang ape akan hasil net present value npv besar us juta dengan internal rate of return irr besar break even poin bep besar juta mt dan payback period pada tahun tulis siar pers usaha kutip selasa jika harga batubara tahan seperti sekarang npv di atas akan tingkat lebih dari dua kali lipat temu cadang dan sumber daya masih akan terus tambah karena bor tahap yang laku hanya kurang dari area iup ape yang dapat tambang,1
nyaman gagah luar kemudi dan tumpang juga manja dengan mewah di dalam kabin misal lapis kulit di sandar tangan tuas kemudi sisi pintu serta panel dashboard ada juga lindung matahari dengan kaca rias dan lampu saat jalan jauh tumpang manja dengan area kokpit yang rancang milik kompartemen limpah misal tempat cangkir di area konsol untuk simpan kopi starbucks,1
tanggap mui jabar tentang wacana legalisasi ganja medis prof rachmat syafeii ketua umum mui jawa barat kata bahwa pihak mui jabar masih tunggu kaji lebih lanjut kena legalisasi ganja medis itu kan masalah kait dengan sehat dengan dokter jadi bagaimana dokter itu nanti ujar rachmat kepada kompas com jumat kena instruksi ma ruf amin yang minta mui buat fatwa baru tentang legalisasi ganja medis rachmat tegas bahwa mui jabar akan ikut putus mui pusat ingat wacana ini rupa soal nasional tapi cara pribadi saya dan rekan mui jabar pasti ikut fatwa dari pusat ujar rachmat,0
cara pertama adalah paham spesifikasi mesin lebih dahulu milik bisa buka buku manual atau cari tahu lewat online dan temu jenis oli yang cocok di sana oleh karena sangat penting untuk kenal mesin dua dengan laku cek kental oli dan kode untuk tahu kental oli milik bisa periksa kode sae society of automotive engineer yang kemudian ikut oleh deret angka di belakang seperti w- w-m w- dan yang lain cara baca kode ini adalah dengan hati huruf w yang dapat di belakang angka awal rupa singkat dari winter misal kode sae w- arti oli sebut milik sae untuk kondisi suhu dingin dan sae di kondisi suhu panas,0
dalam segmen ini beberapa vendor seperti lenovo apple asus hingga hp turut serta ramai saing laptop kelas yang bawa gudang fitur canggih serta dukung spesifikasi dan fitur lengkap yang siap manja para guna dengan desain yang elegan nan stylish untuk lihat daftar lengkap ikut adalah rekomendasi laptop baik di yang cocok untuk ajar serta mahasiswa yang rangkum dari situs rekomendasi ceklist id lengkap spesifikasi dan fitur yang milik,1
dengan langkah sebut di seluruh siklus hidup jaring kami dapat bantu operator dalam bangun jaring yang ramah lingkung cara lebih efektif meski g telah guna cara komersial lama lebih dari dua tahun teknologi ini masih dalam tahap awal untuk tahan sukses g cara komersial kita juga harus kerja sama untuk cipta inovasi dalam kembang ekosistem dan model bisnis komitmen kembang industri dan ekosistem zte telah milik bagai alam dalam teknologi inti produk dan solusi ee dict komponen cloud dan inovasi g kami sedia untuk buka mampu dasar ini kepada seluruh mitra industri dan ekosistem saya senang lihat ke mana tren ini akan bawa kita mari kita kerja sama demi wujud masa depan yang saling untung ucap,1
azizatun kata iring kondisi ekonomi mulai baik pandemi mulai akhir dan masyarakat kembali aktivitas yakin biaya bisa tingkat cepat bri finance tunjuk bagai single gateway auto loan oleh bri bisa garap captive market dari nasabah potensial di dalam bri group branchless financing ini arti kami ada di mana lalu sinergi dengan unit kerja bri sehingga lebih dekat dengan nasabah potensial sehingga nanti kait butuh nasabah utama biaya otomotif mindset-nya bisa langsung ke bri finance terang dia,1
di periode jokowi yang dua sama wakil presiden ma ruf amin tjahjo tetap tahan dia tunjuk bagai menteri pendayagunaan aparatur negara dan reformasi birokrasi menpan rb hingga akhir hayat tjahjo masih jabat bagai menpan rb di kabinet indonesia maju pergi tjahjo tinggal luka dalam tidak hanya bagi keluarga pdip tetapi juga politik dan perintah indonesia,0
dengan begitu telkomsel pasti agar tiap langkah inovasi dan kontribusi nyata dari yangkitabisa ikan akan buka lebih banyak peluang bagi seluruh lapis masyarakat lewat bagai tantang di tiap situasi guna wujud semangat indonesia tumbuh indonesia tangguh direktur utama telkomsel hendri mulya syam kata hari merdeka rupa momen tepat bagi bangsa indonesia untuk sama kembali makna jalan panjang yang sudah lalu oleh bangsa para dahulu telah tunjuk tangguh dalam lalu bagai tantang di tiap fase hidup,1
sementara itu untuk konser hari dua yang jadwal hari ini sabtu november pada pukul wib pihak promotor sendiri telah tambah tugas aman dan medis karena selamat dan alam tonton konser yang aman adalah hal yang kami ingin untuk day kami akan tambah lebih banyak tugas para medis dan juga tenaga aman lanjut nyata dyandra promotor juga akan terus kerja sama dengan pihak polisi tempat dan usaha untuk hindar jadi yang tidak ingin ulang kembali kami harap untuk para tonton day untuk dapat terus jaga prosedur selamat lama acara langsung bunyi nyata promotor,0
