content_lemma,labels
laptop dell xps merk laptop baik untuk mahasiswa pertama kita adalah dell xps yang bawa desain elegan dengan bodi yang ramping dengan bobot kg dengan tebal mm dan mm laptop baik ini bawa dukung layar ultrasharp qhdsharp x pixel ukur inch yang jernih serta tajam dalam cahaya laptop dell baik ini bawa spesifikasi performa yang apik dengan dukung ram besar bg dengan ssd tb yang sokong oleh prosesor inter core i-g generasi ke yang milik kualitas mumpuni sektor kerja transfer data hingga daya konsumsi baterai yang awet laptop dell xps bekal dengan pen stylus dari dell actie pen serta dapat putar derajat yang milik tahan baterai yang awet hingga sampai dengan jam pilih laptop dengan bobot ringan milik banyak sekali untung salah satu dapat bawa mana,1
patrick ru country head huawei cbg indonesia nyata produk ini rancang untuk buat hidup lebih mudah dan lebih nyaman bagi konsumen serta bantu mereka capai tuju bugar guna data ilmiah pantau sehat dan bugar selalu jadi salah satu kuat inti perangkat wearable kami dan kali ini huawei sedia tingkat komprehensif untuk seri gt dengan tambah truseen yang baru kata patrick ru dengan fitur dan akurasi huawei watch gt cocok untuk guna smartwatch baru dan untuk guna dengan aktivitas workout progresif dengan data yang catat cara akurat di jam tangan pintar ini guna akan makin motivasi untuk tingkat kerja latih serta lebih paham kondisi tubuh,1
oppo a oppo a hadir bawa layar ukur inci yang telah lengkap dengan fitur all-day eye care untuk lindung mata guna ketika tatap layar smartphone dalam waktu yang cukup lama di sektor fotografi oppo a andal kamera ai triple hd dengan konfigurasi true mp ai camera mp kamera bokeh dan mp kamera makro tak hanya itu turut serta kamera selfie mp lengkap fitur ai beautification dalam sokong performa oppo a hadir dengan usung prosesor mediatek hio g padu dengan ram gb dan simpan internal gb untuk dukung guna hari lebih oppo lengkap a dengan baterai mah yang sudah lengkap watt fast charge yang dapat isi ulang perangkat dalam waktu menit oppo a sedia salam dua pilih warna rainbow blue dan starry black kait harga ponsel pintar baru itu jual di rp juta,1
dalam upacara makam itu juga sampai baca riwayat hidup singkat serta baca juga bintang jasa dan hormat yang milik tjahjo belum makam jenazah semayam di rumah dinas menteri kompleks widya chandra kemudian jenazah dishalatkan di masjid quba yang ada di kantor kemenpanrb,0
kapasitas memori lega dengan kapasitas memori internal yang lega yakni hingga gb bisa dukung giat fotografi tadi tangkap gambar dan rekam video bisa laku dengan bebas makin banyak foto dan video yang bisa ambil skill fotografi pun tentu akan makin asah dan tingkat karena bisa leluasa mengeksplor hal baru,1
aki oem milik lifetime yang lebih lama guna aki oem kata lebih lama lifetime-nya dari pada aki after market buat aki untuk oem dan afm di yuasa itu proses sama mungkin kondisi untuk motor oem itu komponen listrik masih prima baru sedang untuk aki afm guna pada motor yang kondisi komponen listrik kurang prima kendara sudah guna selain itu pada aki oem dan afm sudah hitung sistem listrik sesuai dengan design kendara,1
waktu lalu makan tak juga kunjung datang tjahjo pun telepon tugas restoran nyata pihak restoran hotel rasa bimbang atas tanggung jawab bayar makan itu bapak tjahjo tamu perintah provinsi bukan lalu siapa yang akan bayar makan ini perintah provinsi atau bapak sendiri kata tugas restoran hotel sebut saya sendiri yang akan bayar makan itu kata tjahjo,0
menteri sekretaris negara pratikno menteri hubung budi karya sumadi menteri daya perempuan dan lindung anak bintang puspayoga menteri investasi bahlil labadila menteri kominfo johny plate juga telah hadir begitu pula eks kepala badan intelijen negara bin hendropriyono yang datang kena peci hitamkuning dan gubernur lembaga tahan nasional lemhanas andi widjajanto hadir pula gubernur jawa tengah ganjar pranowo dan ketua umum partai nasdem surya paloh serta menteri tani syahrul yasin limpo ketua badan awas obat dan makan bpom penny lukito kepala badan nasional tanggulang terorisme bnpt irjen boy rafli amar pantau juga sudah injak kaki di tmp kalibata mereka turun dari mobil pribadi masingmasing belum lalu ke area makam tanpa bicara patah kata pun kepada awak media,0
dua barang rupa keris dan wayang jadi barang sayang menteri pendayagunaan aparatur negara dan reformasi birokrasi menpan rb tjahjo kumolo barang sebut masih simpan rapi di rumah tjahjo yang ada di jalan citarum kota sarang jawa tengah selain keris dan wayang ada beberapa barang lain seperti gentong lukis dan beberapa foto kenang tjahjo sama beberapa tokoh indonesia,0
jumlah media asing sorot aksi presiden ri joko widodo yang bakal jadi pimpin asia pertama yang kunjung ukraina dan rusia di bawah situasi perang salah satu adalah the straits times surat kabar bahasa inggris yang basis di singapura dalam artikel indonesian president joko widodo to visit ukraine and russia amid ongoing war yang terbit pada rabu the straits times ungkap bahwa jokowi akan jadi pimpin asia pertama yang tolak ke ukraina dan rusia sejak perang mulai pada februari,0
erizon kata dua kasus ini masuk dalam data kasus di jakarta yang sampai wagub riza patria dia sebut dua pasien probable hepatitis akut itu masih dalam rawat saat ini masih dalam rawat di rs hermina podomoro kata dia erizon pasti di jakarta pusat belum ada kasus pasien yang diagnosis akhir positif hepatitis misterius jauh ini belum ada lapor yang indikasi diagnosis akhir hepatitis akut dengan sebab belum jelas kata,0
jajar kamera oppo a sebut lengkap dengan deret fitur kamera tambah mulai dari ai palette bokeh flare portrait flash snapshot hingga selfie hdr fitur-fitur ini klaim dapat kaya hasil jepret oppo a juga topang oleh prosesor snapdragon prosesor buat qualcomm itu padu dengan ram kapasitas gb yang dapat besar cara virtual hingga gb dan memori internal hingga gb,1
daftar online lalu website https rekrutmen rsudsidoarjo co id dan laku pada - mei panitia pasti bahwa segala daftar tidak pungut biaya apa alias gratis panitia rsud sidoarjo tidak tanggung jawab hadap oknum siapa baik orang atau lembaga yang mengatasnamakan rsud sidoarjo yang aku bisa bantu mudah lamar untuk dapat terima bagai pegawai blud non asn rsud sidoarjo jelas,1
triton x pilih tawar yang bisa pilih di antara dp rendah mulai dari atau bunga sampai dengan tenor tahun selain itu ada juga gratis ban mt untuk varian sc dc hdx serta gratis biaya jasa dan suku cadang sesuai dengan jadwal service booklet hingga km atau tahun untuk semua varian triton x langgan bisa pilih tawar antara dp rendah mulai dari atau bunga sampai dengan tenor tahun khusus beli triton x di bulan april akan dapat program cashback atau program tawar khusus dari leasing tentu,1
kepala kantor wilayah menteri hukum dan ham kanwil kemenkumham dki jakarta ibnu chuldun klaim bahwa tidak ada kendali jual beli narkotika dari dalam lembaga masyarakat lapas di dki sejak maret hingga saat ini saya masuk jabat kakanwil dki jakarta sejak maret dari sejak itu sampai juni tidak pernah ada kendali narkoba dari dalam lapas di dki jakarta mudahmudahan ke depan demikian ujar ibnu saat temu di lapas narkotika kelas iia cipinang besar utara jatinegara jakarta timur jumat,0
dengan absen turis dari china --kelompok kunjung besar ke thailand belum pandemi melanda-- kembali turis rusia akan cepat pulih industri pariwisata negara sebut ruktaengam juga kata turis rusia rata pelesir tidak hari di phuket guna kartu kredit yang terbit di negara lain atau uang tunai thanet supornsahasrangsi presiden dewan pariwisata chon bur juga utara bahwa bagi besar transaksi uang para turis laku di dubai dan timur tengah turut supornsahasrangsi dalam beberapa bulan ke depan turis rusia akan makin tambah jika rujuk pada data pesan terbang,0
pasal saat ini penyalahgunaan ganja masih banyak temu meski larang oleh hukum negara dan agama islam oleh sebab itu turut rachmat wacana legalisasi ganja untuk butuh medis ini harus kaji dengan hati hati dalam agama itu ada nama tutup jalan untuk jahat itu wajib dokter harus teliti jangan sampai ada simpang yang bisa rusak manusia itu sendiri ujar rachmat wacana legalisasi ganja untuk butuh medis ini rupa respons atas aksi orang ibu nama santi warastuti yang laku aksi damai di kawasan bundar hotel indonesia jakarta minggu,0
jadi tahan fisik main susah sekali kita memang tc pusat latih cepat jadi saat ini kita fokus agar tingkat fisik dasar main ucap lansir dari youtube pssi dalam pandang sang gyu latih di gym untuk kuat otot sangat penting tampil dalam juara dengan jadwal padat dan bolak-balik naik pesawat akan sangat uras fisik,0
smartwatch a smartwatch a rupa salah satu smartwatch murah dengan kualitas baik yang bisa anda pilih meski murah namun smartwatch ini milik fitur yang lengkap layak apple watch selain milik fungsi basic seperti kirim pesan laku dan terima panggil smartwatch ini juga milik slot sd card dan sim card serta lengkap dengan kamera megapixel bukan hanya itu smartwatch ini juga milik fitur mp kalkulator sleeping monitoring hingga pedometer untuk harga sendiri sangat jangkau yakni rp an saja,1
selain itu yang lebih penting lagi yaitu kelola kek sudah bisa undang investor untuk masuk dan kembang giat yang ada di dalam nah untuk dukung kesiap operasi kek nongsa lanjut elen dewan nasional kek dan kemenko ekonomi tetap salah satu dari jabat badan usaha bp batam bagai laksana tugas administrator di kek kenapa ini agak beda dengan kek yang lain yang lain sendiri tapi ini lekat ke bp batam karena banyak hal masuk perihal lahan yang dalam kuasa bp batam sehingga ada sinkronisasi untuk operasional di lapang jelas,0
christian wihananto selaku produser garena free fire indonesia tambah pihak komitmen untuk dapat jaring lebih banyak lagi calon atlet profesional esports atlet yang siap prestasi untuk harum nama bangsa di kancah internasional dengan sedia bagai wadah bagi minat esports free fire mulai dari team profesional semi profesional hingga amatir khusus pada season fall ini kami tingkat jumlah tim yang tanding di divisi dari tim jadi tim dengan harap dapat lahir atlet esports yang handal ucap,1
nama tjahjo memang sudah besar di politik perintah bagaimana tidak lama hidup dia pernah jabat bagai anggota dewan wakil rakyat dpr ri lama periode tjahjo juga jabat bagai menteri di dua kali perintah presiden joko widodo bahkan hingga akhir hayat di parlemen politis pdi juang ini pernah pimpin bagai ketua fraksi partai sementara di internal partai tjahjo pernah emban jabat penting bagai sekretaris jenderal lebih dari paruh masa hidup atau tidak lama tahun tjahjo habis di politik dan perintah,0
laptop lenovo thinkpad x lenovo thinkpad x rupa merk laptop baik dari lenovo yang jadi salah satu produk rekomendasi laptop baik untuk ajar dan mahasiswa yang milik desain body ramping dan juga ringan laptop ini milik kerja yang baik dengan sokong oleh intel core i-u serta ram gb yang longgar laptop baru lenovo thinkpad x milik dukung layar besar ips hd antiglare nits serta jalan pada dukung os windows professional -bit sedang fitur aman sedia fingerprint sensor serta bawa konektivitas port untuk usb type c dan port untuk usb beberapa daftar rekomendasi merk latop baik di di atas cocok untuk jalan bagai aktifitas serta dukung mobilitas bagi para ajar serta mahasiswa dengan dukung fitur oke kerja apik serta baterai awet,1
telkomsel terus komitmen untuk selalu relevan di tiap ubah dalam hidup masyarakat dengan hadir bagai inovasi layan produk dan teknologi yang dapat dukung gaya hidup sekaligus akselerasi maju bangsa makna hari merdeka ke- republik indonesia telkomsel konsisten wujud komitmen sebut dengan usung semangat tangguh di tiap ubah demi kuat tuju dalam buka dunia penuh peluang dan sempat,1
mfc-tdw untuk anda yang ingin buka bisnis atau untuk tunjang aktivitas giat kantor seri ini juga sangat cocok karena printer all-in-one yang dukung volume cetak yang tinggi dengan biaya yang hemat untuk tunjang lancar bisnis anda perlu tahu mfc-tw milik fitur multipurpose tray wifi dan lan duplex print serta automatic document feeder tentu memebuat segala kerja jadi mudah anda bisa dapat seri all-in-one ini sekaligus bropack xtra proteksi hanya dengan harga rp,1
at home with the rozes dua mantan narapidana mg dan gilbert temu lindung di buah rumah yang tawan yang pasang akan raya nikah ke tahun awal mg dan gilbert ingin sandera milik rumah di luar duga mereka malah sambut hangat oleh huni milik rumah juga siap tolong dan tunda raya ulang tahun pernkahan lahan mereka,1
manajer manchester united erik ten hag aku absen bruno fernandes sedikit pengaruh hadap siap tim untuk tarung lawan aston villa di villa park minggu november bruno fernandes lama ini adalah main utama setan merah yang telah pakai ban kapten untuk bagi besar musim ini karena absen harry maguire fernandes akan lewat jalan ke midlands karena skorsing dia terima kartu kuning lima musim ini saat mu menang - atas west ham fernandes gabung dengan united pada januari dari sporting lisbon sejak saat itu cuma sekali diri tidak main bagai starter meski ia belum dalam performa baik musim ini ketidakhadirannya di posisi gelandang serang mungkin akan rasa bagi setan merah,0
captain barbershop satu di antara barbershop yang sedang naik daun adalah captain barbershop diri sejak captain barbershop kini telah milik banyak cabang di seluruh indonesia yakni capai barbershop tak hanya di jakarta barbershop ini juga ada di bandung surabaya hingga medan usung konsep manly barbershop ini tawar agam rawat rambut bagi pria beberapa layan yang beri antara lain grooming atau cukur hair spa smoothing perming coloring anti dandruff treatment hair repair dan juga hair system,1
turut safrizal jumlah daerah di level turun pada panjang ppkm jawa bal kali ini yaitu yang belum daerah jadi daerah jumlah daerah di level turun dari dua daerah jadi satu daerah balik untuk jumlah daerah level naik dari daerah jadi daerah ia kata pola yang sama juga jadi pada panjang ppkm di luar jawa bal jumlah daerah di level turun dari daerah jadi daerah daerah level turun dari daerah jadi daerah sementara itu daerah level naik dari daerah jadi daerah turun jumlah level di beberapa daerah baik di wilayah jawa-bali maupun luar jawa-bali jadi warning bagi kita ucap,0
staging arah suara yang sangat impresif rasa sekali semua tepat vokal rasa di tengah sementara instrumen lain menyelimputi keseluruha aransemen lagu dengan baik snare drum juga dengar renyah dan pas frekuensi mid hingga mid-high adalah suara baik saat dengar lagu bts baru tajuk butter dengan volume sekitar persen suara rasa paling pas,1
commercial industrial printer warna printer yang luar biasa dan jadi pilih yang tepat untuk dukung bisnis dari advertising fashion retail dan photography print head epson micro piezo thin film piezo rupa salah satu seri dari commercial industrial printer yang khusus kembang untuk printer large format epson milik performa dan daya tahan tinggi dengan micro-fine nozzles untuk tiap warna beri bentuk dot titik yang sempurna hasil adalah cepat cetak dan mutu gambar yang tinggi untuk pakai di bagai giat usaha dan industry,1
kabin lebih hening honda klaim kedap kabin all new hondabr-v persen lebih hening banding versi belum dan ini rasa sekali saat jalan di tol bising mesin dan jalan tidak terlalu ganggu suara musik juga dapat dengar lebih jelas,1
sementara tiga orang lain - nathania kesuma vanessa khong dan rudiyanto pei - tetap bagai sangka dengan pasal cuci uang karena nilai ikut terima alir dana dari indra dan aktif sembunyi dana haram sebut bareskrim nyata bahwa total korban tipu yang laku indra kenz dan binomo ini banyak orang dengan rugi capai rp miliar sidik kata dia masih lengkap berkas perkara sangka indra,0
lampu belakang hondazrv adalah led bentuk ramping dan dapat spoiler yang pasang di atap yang sudah lengkap stoplamp dapat juga lencana turbo di tailgate sama seperti honda integra yang pasar gac honda ini arti honda zrv bekal mesin bensin vtec l turbocharged yang mampu hasil tenaga ps dan torsi puncak nm mesin sebut kawin dengan sistem transmisi cvt,1
kini morgan ungkap cakap teks pertama dengan ronaldo telah pergi dari manchester united awal ketika ronaldo keluar dari mu saya kirim cristiano gif william wallace di braveheart sambil teriak freedom kata morgan kepada the telegraph kutip dari min dia pikir itu adalah kata sempurna dari apa yang dia rasa ronaldo jawab bebas seperti burung itu adalah tanggap ucap morgan tambah,0
di sisi lain puan aku tjahjo memang belum tuntas tugas bagai menpanrb lantar telah tinggal dunia belum selesai kerja hingga namun puan nilai kerja tjahjo di menteri panrb sudah rasa manfaat oleh masyarakat saya rasa bisa sama sama ikut apa yang beliau laku itu dapat manfaat bagi bangsa kata puan,0
buah tim yang diri dari empat sukarelawan kemudian kirim dan lacak fitur sos darurat apple saat ini baru sedia di as dan kanada rencana apple akan segera luas layan fitur sos untuk jumlah negara seperti prancis jerman irlandia dan inggris di akhir bulan ini,1
susun main indonesia vs china komang ayu cahya dewi vs chen yu fei febriana dwipuji kusuma amalia cahaya pratiwi vs chen qing chen jia yi fan bilqis prasista vs he bing jiao nita violina marwah lanny tria mayasari vs huang dong ping zheng yu siti sarah azzahra vs wang zhi,0
namun bukan hanya kota buruk riset sebut juga identifikasi kota yang buat para kunjung puas dan bahkan lebih dari ekspektasi mereka belum kunjung analisis sebut temu bahwa budapest hungaria milik persentase tinggi banyak persen ulas yang isi komentar positif banyak mereka yang kunjung puji indah kota dan sebut budapest takjub,0
kemudian jenazah tjahjo tiba di rumah duka pukul wib pada jumat jenazah bawa guna mobil ambulans dan iring beberapa polisi belum datang jenazah beberapa politis dan menterimenteri tanah air lihat sambang rumah duka jumlah karang bunga dengan ucap bela sungkawa juga lihat datang gilir,0
bahan dari plastik dengan muka yang glossy case sebut sudah lengkap led serta selot usb-c jika anda aktif guna tidak ada salah untuk beri tambah silicon case supaya tidak mudah baret atau kotor harga silicon case di toko online cukup jangkau mulai rp ribu hingga rp ribu,1
lebih lanjut dia ungkap salah satu faktor kuat dua motor listrik itu bisa kompetitif yaitu tidak impor lain langsung masuk jalur produksi honda di indonesia tahu usaha logo sayap ini milik pabrik di beberapa daerah seperti sunter kelapa gading hingga cikarang iya motor listrik ini mau produksi lokal nanti ya tahap jelas dalam sempat yang sama direktur pasar pt astra honda motor ahm thomas wijaya tambah pihak bakal sedia dua pilih jenis baterai hal itu laku agar calon konsumen bisa pilih sesuai butuh mereka untuk jenis baterai dua karena orang indonesia kan ada yang pakai jarak dekat dan bagai mungkin dia lebih nyaman dengan direct charging tambah thomas usaha logo sayap ini tengah pamer konsep honda e technology yang beri pilih isi daya ulang motor listrik dengan cara isi langsung direct charging dan tukar ganti swapping battery,0
saat kendara sepeda motor beberapa orang butuh aksesoris tambah untuk mudah mereka saat di jalan ada banyak macam benda dukung khusus kendara roa dua salah satu aksesori dukung yang banyak guna adalah box yang biasa semat di bagi belakang benda sebut milik fungsi penting untuk bantu dalam bawa lebih banyak barang ketika pergi dengan motor lalu pamer indonesia motorcycle show imos yang tengah langsung di jakarta convention center jcc senayan di sana tidak hanya tampil sepeda motor saja tetapi juga aksesori dukung yang hadir untuk para kunjung salah satu brand aksesoris yang ikut memeriahkan giat ini adalah givi peruahaan aksesori motor asal italia ini hadir tiga produk baru sekaligus untuk pasar otomotif indonesia,0
indonesia nanti akan dapat satu slot yang kini sedang rebut dalam arena of valor star league asl winter yang sudah gulir sejak hingga oktober selain tim dari indonesia di aov international championship juga akan ikut total tim dari seluruh penjuru dunia mulai dari thailand vietnam cina hongkong dan korea selatan turnamen aov international championship ini bakal helat mulai november hingga desember atau bareng dengan ulang tahun lima arena of valor yang jatuh pada november datang tunggu apa lagi segera selesai tantang wave sekarang juga dan dapat oppo reno wave special limited edition cm,1
perangkat ini juga mampu ukur tingkat saturasi oksigen kapan saja sensor ukur detak jantung dengan presisi tinggi juga hadir rasa tenang bagi guna karena bisa beri informasi cara lengkap begitu baterai isi penuh redmi watch lite bisa guna hingga hari ke depan dan isi daya laku cara mudah dengan koneksi magnet xiaomi smart air purifier pro pasti bahwa kualitas udara di sekitar tetap jaga dengan pasok udara segar hingga meter kubik per jam dan juga filter yang mampu saring persen dari partikel mikro seperti bulu binatang debu asap dan partikel mikro lain yang ukur hingga mikron tambah sensor presisi tinggi yang bantu deteksi polutan udara cara langsung,1
edar di media sosial postingan judul uskup katolik jabodetabek deklarasi dukung anies baswedan jadi presiden postingan itu edar sejak beberapa hari lalu salah satu akun ada yang unggah di facebook pada oktober dalam unggah dapat gambar dengan narasi ikut ini buzzer kejang para uskup katolik sejabodetabek deklarasi anies hari ini akun itu tambah narasi ya tuhan para uskup sejabodetabek sudah beri dukung moga paus indonesia bisa beri dukung juga,0
namun meski tempat sederhana kuliner yang pilih tjahjo turut selalu lezat saya kenang beliau bagai pribadi yang sederhana gemar kuliner dan ajak kami ke tempattempat makan yang sederhana tempat makan lokal tetapi rasa memang nikmat ujar eriko dalam siar langsung kompastv jumat eriko sebut diri pernah ajak kuliner di kawasan tebet dan jakarta kota turut salah satu kuliner yang sering datang almarhum adalah sop kambing,0
patrick ru country head of huawei cbg kata huawei seri p adalah bentuk semangat untuk terus cipta kualitas estetika dan alam fotografi baik dan bagai legenda yang lahir kembali huawei p pro kembali jantung fotografi kelas atas lalu kamera true to life huawei xd optik yang revolusioner dan tingkat kualitas fotografi seluler smartphone ini juga rancang bagai kamera klasik-instan yang gabung bentuk tawan dan fungsi depan dalam desain cincin ganda yang ikonik kata,1
rear shock-absorber new xpander dan new xpander cross sama dengan pajero sport high performance valve new xpander dan new xpander cross biasa guna oleh brand mewah eropa berkat tingkat ini dua jenis kuda besi ini dapat capai tangan dan stabilitas yang lebih nyaman untuk kendara yang lebih stabil di jalan yang kasar selain itu atur suspensi sesuai untuk muat lokal indonesia pada saat yang sama juga bisa capai ground clearance yang lebih tinggi dan visibilitas yang baik untuk dukung kendara di bagai medan,1
oppo a oppo a bekal dengan baterai kapasitas mah yang sudah dukung teknologi isi daya cepat w supervooctm dengan dukung teknologi isi baterai sebut oppo a dapat isi persen dalam waktu menit dan isi penuh hingga persen hanya dalam waktu satu jam oppo a juga serta fitur super power saving mode untuk panjang masa pakai baterai oppo a sendiri usung layar inci dengan screen-to-body ratio dan resolusi fhd x layar ini juga hadir ntsc wide color gamut dan sudah dukung refresh rate hz untuk urus fotografi oppo a bekal dengan dua kamera belakang yang diri dari kamera utama mp dan kamera bokeh mp tidak henti di situ semat juga kamera depan resolusi mp oppo a juga topang oleh prosesor snapdragon prosesor buat qualcomm itu padu dengan ram kapasitas gb yang dapat besar cara virtual hingga gb dan memori internal hingga gb untuk sistem operasi sendiri jalan di android dengan antarmuka coloros smartphone ini dibandrol rp,1
ia jelas temu dengan tjahjo jadi minggu yang lalu saat itu mahfud jenguk di rumah sakit abdi waluyo namun dalam temu itu dua tidak saling komunikasi karena tjahjo minta istirahat total dokter saran agar istirahat tidak ganggu tapi saya ada dekat beliau waktu itu meski enggak ngomong enggak komunikasi pungkas,0
telkomsel sama apple umum hadir paket bundling seri iphone program ini dukung bonus kuota data layan g hingga gb bagi langgan telkomsel halo pascabayar dan telkomsel prabayar vice president postpaid consumer international roaming and interconnect telkomsel bernadus wahyu wijayanto kata lalu kolabarasi ini langgan dapat menkmati ragam pilih paket bundling dengan dukung jaring broadband yang luas dan cepat,0
laptop toshiba portege xw lanjut ada toshiba portege xw yang jadi salah satu merk laptop baik di yang milik mampu handal dengan dukung prosesor core i-u dengan cepat capai ghz cocok untuk dukung kerja kelas ringan hingga berat laptop mewah toshiba ini milik bobot kg dengan tebal mm yang cukup ringan dan compact laptop baik toshiba portege xw hadir dengan layar diagonal inch dengan resolusi fullhd x piksel dukung sentuh hingga jari anti-glare serta lindung oleh antigores corning gorilla glass yang kokoh sedang untuk mesin utama andal dukung prosesor intel core i-u yang mampu laju hingga cepat hingga ghz ram gb dan simpan ssd up to gb windows professional -bit serta dukung baterai yang tahan lama hingga tahan lama jam,1
layar teknologi psr lengkap dengan memori khusus yang integrasi berkat memori sebut tiap tampil statis pada layar dapat proses tanpa lalu chip grafis sehingga konsumsi daya dapat kurang hingga ke angka watt sedang proses tampil layar guna chip grafis dapat makan daya hingga watt layar teknologi psr sangat cocok untuk guna yang sering jalan aplikasi bisnis dan kantor seperti microsoft office serta buka dokumen pdf dan gambar statis,1
