content_lemma,labels
dobrak batas desain lalu rancang bodi minimalis yang tipis dan ringan dalam balut material premium layak laptop flagship masing-masing huawei matebook d dan huawei matebook d milik berat kg dan kg tebal mm dan mm serta rasio screen-to-body yang tinggi yakni d dan d bagai unggul sebut mampu buat guna makin percaya diri produktif dan aktif dalam manfaat komputasi dalam aktivitas hari yang padat rahasia di balik desain yang premium dua laptop ini letak pada seluruh bahan yang guna kerja yang apik dan kualitas buat jajar laptop huawei mulai dari segi kualitas buat tiap perangkat huawei matebook mulai dari kelas entry level hingga flagship milik sasis logam yang ringan untuk sempurna elegansi desain cara seluruh selain itu rangkai laptop sebut rancang ergonomis dengan muka kilau dari bahan aluminium mutu tinggi guna pasti nyaman saat genggam dan tahan saat bawa ke sana kemari tidak tinggal adalah otomasi lanjut dengan standar kualitas tinggi lalu kolaborasi huawei sama mitra andal yang pilih dengan cermat dan milik kualitas global,1
cepat refresh rate hingga hz dengan adaptivesync akan manja guna ketika selancar di internet maupun main game cara lancar hadir teknologi adaptivesync yang mampu cara otomatis suai cepat refresh rate sesuai jenis konten yang sedang saksi di layar akan pasti konsumsi daya baterai perangkat jadi lebih hemat selain itu fitur reading mode akan bantu mata guna jadi lebih rileks dan tidak mudah lelah ketika baca maupun saksi konten favorit di redmi,1
lama pamer giias langsung tak hanya hyundai cetra yang hadir hyundai motors indonesia juga turut hadir jajar produk ev nya saat ini yaitu kona electric dan ioniq electric yang mana rupa lini produk ev unggul dari hyundai yang sudah dapat sambut positif dari konsumen otomotif indonesia tak hanya itu hyundai juga hadir jajar produk unggul mulai dari hyundai staria palisade new santa fe selain bisa nikmat fitur-fitur canggih hyundai motors indonesia juga beri banyak tawar spesial tarik lama selenggara giias yaitu,1
berita kantor berita rusia tass lavrov dan guterres telah bahas tahan pangan di tengah situasi di ukraina dan donbass lama panggil telepon pada rabu para pihak bahas beberapa masalah internasional yang paling desak dengan tekan pada tahan pangan di tengah situasi di ukraina dan donbass kata menteri luar negeri rusia dalam nyata menteri beri nilai rinci rusia tentang situasi saat ini di ukraina di dpr dan lpr masuk dalam konteks pasok produk tani dan pupuk di pasar global digarisbawahi bahwa ekspor gandum ukraina cegah oleh tambang laut hitam oleh kyiv tambah nyata itu,0
menteri sekretaris negara mensesneg ri pratikno pimpin upacara makam menteri pendayagunaan aparatur negara dan reformasi birokrasi menpanrb tjahjo kumolo tjahjo makam di taman makam pahlawan tmp kalibata jakarta selatan jumat sore almarhum tinggal dunia di rumah sakit abdi waluyo jakarta pusat sekitar pukul wib saya pratikno menteri sekretaris negara republik indonesia atas nama negara bangsa dan tentara nasional indonesia dengan ini sembah gelar persada ibu pertiwi jiwa raga dan jasajasa almarhum tjahjo kumolo menteri pendayagunaan aparatur negara dan reformasi birokrasi ucap pratikno moga jalan dharma bakti yang tempuh dapat jadi suri tauladan bagi kita semua dan arwah dapat tempat yang mesti di alam baka tutur,0
inktank printer printhead seri ecotank dengan teknologi micro piezo inktank printer printhead seri ecotank rupa teknologi eksklusif dari epson rancang kerja andal dan tahan lama printhead micro piezo mungkin cetak pada bagai jenis media ada pula fitur cetak cepat proses gambar system tinta pindah kertas dengan sangat akurat dan mekanisme lain,1
selain dua model box sebut shad juga tawar agam pilih box lain seperti sh harga rp ribu sh banderol rp juta sh tawar rp juta dan sh dengan harga rp juta bagai tambah informasi untuk cari box sepeda motor bisa datang langsung di imos untuk tiket pamer bisa beli langsung lalu aplikasi auto harga rp ribu,1
tak mau kalah amerika serikat kemudian juga terbang pesawat kiamat yaitu boeing e-b nightwatch sekitar jam sudah rusia terbang pesawat kiamat pesawat itu terbang dari edwards air force base di california oleh personel dari th flight test squadron di udara pesawat kiamat as lalu isi bahan bakar oleh pesawat tanker kc- pegasus memang ini salah satu mampu dapat isi sumber daya saat terbang seperti hal milik rusia juga punya fitur rupa,0
mahfud lalu balas dia nilai paham said didu bukan bagai paham hukum mahfud juga sebut saat ini lgbt dan siar belum larang oleh hukum sehingga kasus konten youtube deddy corbuzier nilai bukan kasus hukum,0
kepala desa podenuran anselmus nura kata warga di desa di camat keo tengah isolasi akibat putus jalan itu turut warga tidak bisa laku jalan tuju ke kabupaten ende untuk jual hasil tani begitu juga dengan butuh sembako yang biasa dapat dari kabupaten ende paksa tunda sambil tunggu akses jalan baik dan tidak ada banjir lagi warga harus guna jalan lain dengan waktu tempuh yang jauh lebih panjang dan biaya tinggi ungkap dia anselmus kata pihak sudah usul bangun jembatan di kali dowosude lalu musrenbang sejak tahun hingga kini usul itu belum realisasi,0
samping itu kata putin ada tarik untuk kembang industri tenaga nuklir nasional dari usaha rusia dengan alam unik kompetensi dan teknologi yang tak tanding rosatom state corporation sedia ambil bagi dalam proyek sama masuk proyek yang kait dengan guna non-energi teknologi nuklir misal di bidang dokter dan tani,0
dua aspek ekosistem seperti sdm bijak atur dan lain sehingga operator bisa jalan pandu masing-masing yang harus inline dengan roadmap perintah jangan lagi operator paham semua bts bangun sendiri kita sedang dorong konsep sharing di undang cipta kerja kita sudah masuk atur untuk sharing karena g ini kalau bangun sendiri sangat costly untuk backbone backhole dan spektrum juga di-sharing atur tentang sharing ini sudah selesai mulai dari uu sampai atur menteri kata ismail,1
turut gufron akan sangat baik jika polri jadi ingat hari bhayangkara bagai titik tolak untuk jawab tiap kritik atas kerja polisi lama ini masuk dorong kembali agenda reformasi polisi polisi profesional adalah polisi yang jamin hormat dan lindung ham ujar gufron isu ham di polisi kata gufron masih jadi catat kritik yang sampai masyarakat sipil turut gufron masih ada jumlah simpang yang laku anggota polri saat jalan tugas simpang itu antara lain keras dalam tangan demonstrasi siksa dalam tegak hukum batas bebas kriminalisasi aktivis hal itu turut gufron masih jadi catat buruk atas kerja tegak hukum polisi,0
untuk performa kuda besi ini guna mesin baru nama katup esp atau enhanced smart power plus kapasitas cc mesin sebut mampu hasil tenaga daya kuda dengan torsi newton meter maka tak heran motor sebut jadi favorit kunjung di arena test ride imos bagi masyarakat yang ingin lihat bagai teknologi baru maupun coba motor bisa datang di pamer ini dengan tiket harga rp ribu,0
dia tutur para siswa yang ajar oleh guru harus jadi sdm unggul dan harus milik beberapa komponen baik seperti kuasa ilmu tahu dan teknologi iptek sehingga tingkat terampil teknis yang relevan dengan kembang zaman jokowi juga minta agar para guru bisa beri proses ajar yang baik sebab bukan hanya hasil tapi proses dalam ajar juga sangat penting dalam hasil anak yang cerdas dan kritis proses yang penting dalam ajar turut saya bagaimana proses ajar itu agar anak milik daya kritis yang baik ujar,0
selain hadir seluruh produk dan layan unggul dari sisi sales maupun after sales mmksi juga beri booth experience yang tarik untuk beri inspirasi dalam life adventure para kunjung iims mmksi hadir adventure in life corner yang diri dari photo booth dan video booth di mana para kunjung dapat dokumentasi momen life adventure mereka di booth mmksi dan bagi momen mereka di sosial media serta online community mitsubishi mimate mana momen paling tarik akan sempat untuk dapat hadiah dari mmksi untuk tahu dan rasa seluruh aktivitas yang hadir oleh mmksi di ajang iims kunjung dapat langsung kunjung booth mmksi yang tentu terap protokol sehat yang sangat ketat,1
belum temu presiden ukraina volodymyr zelensky presiden ri joko widodo agenda akan lebih dulu kunjung puing kompleks apartemen lipky di kota irpin ukraina presiden joko widodo dan ibu negara tahu telah tiba di ibu kota kyiv pada rabu telah tempuh jalan lama lebih dari jam dengan kereta luar biasa klb yang siap perintah ukraina presiden jokowi dan rombong batas tiba di peron stasiun central kyiv sekitar pukul waktu tempat,0
get ur dream sutradara oleh reka wijaya yang belum sudah menyutradari beberapa sitcom seperti bajaj bajuri kejar tayang dan tetangga masa gitu bagai informasi series get ur dream bisa saksi cara gratis di maxstream waktu kita brainstrom kita bahas apa tentang kuliah saya analogi dengan mangkuk mau isi apa nih kita cari ide yang fresh gitu proses lama sih tiap episode hampir dua minggu telah dapat background story-nya kita benar rangkai kata raka wijaya,0
lima pasang bukan suami istri jaring unit lindung perempuan dan anak ppa polrestabes makassar dalam operasi sweeping di jumlah indekos yang sinyalir kerap jadi tempat mesum kasat reskrim polrestabes makassar akbp reonald simanjuntak kata pihak laku operasi di tiga tempat yakni di jalan ance daeng ngoyo jalan urip sumoharjo dan jalan boulevard,0
sementara itu dasar terang dari situs resmi perintah ukraina pada rabu jelas bahwa sepakat hapus syarat visa kunjung singkat indonesia dan ukraina ditandangnai oleh menteri luar negeri masing-masing prosesi penandatanganan oleh menteri luar negeri ukraina dmytro kuleba dan menteri luar negeri ri retno marsudi sebut adakan di gedung menteri luar negeri ukraina janji itu di antara akan mungkin jalan bebas visa hingga hari lama tiap kunjung warga negara ukraina ke indonesia untuk jangka waktu sampai dengan hari bagi warga negara indonesia wni yang tiba di ukraina dalam periode waktu hari di wilayah ukraina sebut lebih lanjut bahwa warga negara ukraina telah dapat mungkin fasilitas bebas visa untuk masuk ke indonesia sejak,0
redmi buds hadir dengan jumlah lebih rupa alam nikmat musik cara nirkabel dan dalam kualitas tinggi lalu mm dynamic driver bobot gram buat nyaman pakai lama di telinga tanpa buat pegal kepala dengan baterai yang dukung hingga jam pakai perangkat audio ini mampu teman aktivitas hari bahkan di tengah ciprat hujan atau mandi keringat berkat dukung sertifikasi ip,1
remote engine start sendiri golong fitur high end di kelas suv -seater belum fitur ini hanya ada di produk high end honda seperti all new honda civic hingga honda cr-v selain itu honda br-v tipe e ini juga bekal fitur rear seat reminder yang sangat guna bagi mereka yang suka lupa letak barang di baris belakang mobil banderol all new honda br-v e m t rp dan all new honda br-v e cvt adalah rp tiga model ini cocok bagi mereka yang ingin upgrade ke all new honda br-v tapi milik bujet bawah atau tak lebih dari rp juta,1
namun bantu itu kira akan serah jokwi kepada presiden zelensky saat temu dua nanti presiden jokowi dan ibu iriana jokowi serta rombong batas lapor telah berangkat tuju kyiv ukraina guna kereta dari stasiun przemysl glowny di kota przemysl polandia pada selasa pukul waktu tempat kepala negara dan rombong guna kereta luar biasa yang siap oleh perintah ukraina seperti juga guna oleh pimpin negara yang kunjung ke ukraina beberapa waktu lalu telah dari kyiv presiden jokowi agenda tolak ke moskwa untuk temu presiden rusia vladimir putin,0
siapa tak kenal tjahjo kumolo sosok malang lintang di dunia politik dan perintah jumat indonesia hilang menteri pendayagunaan aparatur negara dan reformasi birokrasi menpan rb itu tjahjo embus napas akhir di rumah sakit abdi waluyo jakarta pusat sekitar pukul wib belum tutup usia dia rawat intensif di rumah sakit karena alam komplikasi organ dalam,0
hal ini jalan dengan komitmen garena untuk buat bagai event esports free fire dapat akses dengan mudah oleh para survivor dan fans free fire mana mereka ada dengan lebih dari juta tonton dari seluruh indonesia yang saksi seluruh free fire master league season iii kami harap kompetisi free fire dapat satu komunitas passionate gamers indonesia mana mereka ada sekaligus inspirasi calon talenta baru di dunia esports ujar selenggara ffml season iii dan ffim spring turut tegas posisi garena free fire bagai esports mobile game of the year yang beri oleh esports awards di tingkat nasional game ini juga terima harga bagai game esports favorit indonesia oleh indonesian esports awards,1
garena ucap selamat kepada enam tim dari divisi dan tiga tim dari divisi yang tak hanya hak bawa pulang prize pool namun juga oleh tiket ke tanding ikut di free fire indonesia master spring ujar juang para tim esports ini awal dari ffml season iii yang buka januari lalu target lebih banyak atlet muda esports yang kembang readythemaster turnamen ffml rancang bentuk sistem turnamen jenjang lalu skema dua divisi ffml tidak hanya tuju untuk pro-player tetapi juga jadi wadah siap kompetisi esports bagi para talenta baru,1
empat kini hanya status saksi sementara sepeda motor dan celada dalam perempuan yang belum aman akan kembali sudah saya sampai ini jadi akhir supaya tidak ulang lagi untuk barang bukti akan kami kembali kepada yang sangkut tutur miko belum viral video yang lihat orang wanita kendara motor tutup pelat nomor guna celana dalam warna merah muda aksi itu duga untuk hindar tilang elektronik yang deteksi lalu pelat nomor,0
beres dengan nxde miyeon minnie soyeon yuqi dan shuhua langsung hajar tampil dengan lagu dua yang tajuk lion yang rilis pada lalu usai nyanyi lagu dua para member langsung sapa para tonton para personel juga kenal diri dengan gaya khas masing-masing tak lama telah sapa para tonton g-idel lanjut tampil bawa lagu latata dan liar telah mereka bawa never stop me yang ikut tulis soyeon,1
said jelas tiga alas mengapa buruh tolak usul no work no pay pertama turut karena tentang dengan uu no tahun tentang ketenagakerjaan maupun omnibus law uu cipta kerja dua upaya untuk hindar phk telah atur dalam atur menteri ketenagakerjaan seperti kurang shift kerja rumah atau kurang jam kerja tanpa potong upah tiga karena usul ini rugi buruh,0
zulpan kata modus operandi yang laku laku adalah pindah isi tabung gas elpiji dari kemas kilogram ke tabung gas elpiji kilogram modus ini pindah isi tabung gas elpiji kg yang subsidi ke tabung gas elpiji kg non-subsidi imbuh zulpan dari lokasi sebut polisi sita jumlah barang bukti antara lain tabung kosong kemas kg tabung isi kg tabung kosong kg dan alat suntik kemudian aman juga tabung kilogram isi hasil pindah dari tabung gas yang subsidi tadi tutur,0
selain terus inovasi dalam teknologi dan produk vivo tunjuk komitmen dalam kembang layan purnajual yang lebih modern dan puas bagi konsumen di indonesia komitmen ini tunjuk lalu konsistensi vivo dengan modernisasi dan luas jangkau service center untuk tempat layan purnajual yang sebar di bagai daerah sejak pertama kali beri layan purnajual di indonesia pada vivo terus tambah jumlah lokasi service center bagai tempat bagi konsumen untuk periksa konsultasi dan baik produk smartphone vivo tahun ini vivo milik lebih dari fasilitas service center resmi yang sebar di seluruh provinsi di indonesia dari banda aceh ke sorong papua barat,1
redmi watch lite rupa jam tangan pintar baru yang hadir gaya hidup yang lebih aktif bagi guna berkat layar inci yang mampu tampil detail dengan resolusi tinggi serta alam sentuh yang lebih baik catat segala capai olahraga lalu fitness mode yang bantu guna untuk capai tuju latih dengan baik dukung untuk sinkronisasi ke layan yang populer pakai seperti strava serta dukung atm pasti bahwa perangkat ini tahan air hingga bisa bawa renang,1
belum komisi i dpr telah cara resmi tuju yudo bagai panglima tni ganti jenderal andika perkasa putus itu ambil usai komisi i gelar uji layak dan patut fit and proper test hadap yudo lama tiga jam di kompleks parlemen jumat hari ini dalam acara sebut yudo juga singgung soal aman di papua turut yudo jumlah daerah di papua saat ini milik kondisi beda meski jumlah wilayah kini nyata telah kondusif beberapa daerah lain nilai masih rawan,0
rangkai produk rawat wajah ini inspirasi dari karakter milenial yang selalu ingin tahu dan coba hal baru produk ini fokus pada keseahatan kulit rangkai rawat wajah youthera diri dari facial wash toner essence serum hingga krim siang dan malam lina pasti bahwa produk kualitas efektif aman dan halal,1
muslim pro satu aplikasi yang tidak boleh tinggal adalah aplikasi muslim pro selain guna untuk ingat waktu sholat aplikasi ini juga bisa guna untuk beri rekomendasi tempat makan halal aplikasi muslim pro juga memikiki fitur guna lain seperti alquran arah kiblat asmaul husna kalender hijriyah informasi tata cara haji dan umrah doa hari dan banyak lagi,1
dengan tiga smartphone oppo ini tidak perlu khawatir habis baterai karena baterai sendiri sudah ukur jumbo sekalipun baterai habis isi bisa laku alam waktu singkat selain itu oppo juga serta smartphonenya ini dengan fitur super power saving mode untuk panjang masa pakai baterai guna smartphone bisa laku hari penuh,1
untuk tahun empat ini pubg mobile mempunya target lebih besar lewat pmcc yakni cetak main profesional dari kampus salah satu tim universitas sam ratulangi manado yang menang pmcc apa untung tim kampus ikut ajang pmcc pertama mereka sempat wakil almamater atau bahkan indonesia di ajang pubg mobile campus championship south-east asia pmcc sea pada - desember nanti dua pmcc kali ini juga sedia prize pool besar rp juta bagi tim kampus yang hasil dapat gelar juara,1
milik koneksi internet yang cepat dan stabil kini telah jadi kata kunci lancar aktivitas digital yang kita laku saat koneksi internet masalah aktivitas digital kita pun akan hambat saat ini kita memang telah ada di era digital di mana nyaris semua aktivitas kita tak dapat jalan optimal tanpa bantu internet seperti ajar sekolah ibadah usaha online belanja dan giat lain yang mana semua saling hubung satu sama lain cara digital kita bisa laku bagai aktivitas dari rumah kantor atau dari tempat umum lain di seluruh dunia lama kita milik koneksi internet yang kualitas dan dapat andal,1
mewah lain rasa dengan ada eco indicator agar kendara lebih hemat juga digital a c yang mudah atur guna juga bisa nyala mobil dari luar lewat remote engine start sedia hingga tipe e cvt all new honda br-v adalah mobil yang memang rancang untuk keluarga indonesia mobil yang buat kemudi rasa percaya diri lewat performa asyik serta teknologi limpah tapi juga buat tumpang nyaman untuk sekadar ke mal atau tempat hibur hingga jalan panjang,1
mnc portal indonesia sempat coba fitur kamera microlens pada oppo reno g hal pertama yang pikir adalah tangkap tekstur muka daun bukan hanya ruas saja yang lihat tapi juga tampak serat daun pada jumlah jenis daun juga bahkan lihat bulu halus begitu pada handuk yang milik serat khas banyak object yang tidak kira muncul ketika kami arah kamera microlens oppo reno g,1
sedang di kolombia zte sedia solusi telemedicine ee g untuk bantu rumah sakit dalam kurang kontak langsung antar dokter dan pasien lama pandemi hal ini dapat turun risiko infeksi dan sempit waktu diagnosis hingga persen hingga saat ini zte telah kerja sama dengan lebih dari operator dan lebih dari mitra di seluruh dunia untuk laku eksplorasi aplikasi g cara luas di lebih dari bidang industri serta kumpul bagai kasus guna aplikasi industri yang inovatif bawa hidup digital yang penuh warna,1
sedang cari laptop baik yang cocok untuk ajar serta mahasiswa yang milik kerja apik anda bisa coba beberapa daftar rekomendasi laptop baik yang hadir bawa dukung spesifikasi yang handal mampu dukung bagai giat hari anda agam pilih merk laptop baik kini sedia di pasar yang bisa anda pilih sesuai dengan butuh banyak vendor yang rilis produk baru rupa laptop kini yang tuju untuk kelas tengah atas utama bagi para ajar yang butuh laptop dengan kerja tinggi,1
ground clearance tinggi di atas kertas all honda br-v milik ground clearance mumpuni untuk hadap segala medan jalan berapa tinggi ground clearance all new honda br-v jawab adalah mm lebih tinggi banding honda br-v generasi belum yang mm apakah ground clearance all new honda br-v paling tinggi jawab tidak,1
jumlah sopir angkut kota angkot di sukabumi jawa barat keluh rencana beli bahan bakar minyak bbm subsidi guna mypertamina jangan sulit sopir angkotlah sudah tumpang susah sekarang beli pertalite juga harus daftar segala ungkap padil kepada kompas com saat antre di stasiun isi bahan bakar umum spbu jalan tipar gede jumat padil aku milik telepon genggam namun telepon genggam bukan android jadi tidak bisa pakai untuk daftar beli pertalite lalu mypertamina hp handphone saya cuma cinitnit hp jadul aku sopir angkot dengan nomor lambung jurus sukaraja,0
g juga tingkat lingkung kita dengan kualitas air dan udara yang lebih baik sehingga dorong bangun lanjut aplikasi inovatif yang kita milik saat ini tentu perlu kembang lebih lanjut dengan hati skala ekonomi dan model bisnis namun satu hal yang harus tangan adalah platform dukung digital seperti yang telah tahu dekat yang orientasi pada data data driven rupa kunci transformasi digital dari ratus ribu sektor vertikal sehingga dekat yang orientasi pada komputasi telah alih jadi dekat yang orientasi pada data dengan paham ini landas digital digital foundation yang pegang peran penting harus terus tingkat dalam hal ubiquitous broadband pervasive computing dan multi-dimensional convergence,1
kurang kerja administratif sehingga hr bisa lebih fokus laku rancang program kembang kerja karyawan ambil putus strategis lebih mudah karena dukung oleh data yang simpan dalam server basis cloud sehingga dapat akses kapan saja bahkan lalu perangkat lain di luar kantor selain itu sistem cloud juga lebih up to date sehingga hr dapat pantau jika ada data hadir karyawan baru yang masuk,1
yamaha mio m untuk motor akhir yang murah di pamer ini datang dari yamaha dengan model mio m tahu model ini dapat segar warna yang lebih segar dan trendy untuk anak muda hal itu laku oleh usaha demi ikut kembang tren di pasar otomotif indonesia bicara soal performa model ini usung mesin cc teknologi blue core mesin ini mampu hasil tenaga daya kuda dengan torsi newton meter tenaga guna tipe transmisi v-belt otomatis perihal harga usaha asal jepang ini tawar harga satu unit mio m mulai rp juta otr dki jakarta motor matik ini hadir dengan empat pilih warna baru yakni metallic cyan metallic white metallic red metallic black,1
nuansa makin nyaman dan mewah dengan interior kelas hyundai creta jadi primadona dalam pamer giias yang langsung mulai - november bagaimana tidak jadi incar para cinta otomotif hyundai creta milik deret fitur premium canggih di kelas antara lain antara cooled glove box di mana laci dashboard dapat guna bagai tempat untuk jaga segar makan dan minum anda makin nyaman kendara atau pergi jauh saat kendara,1
butuh masyarakat akan hibur di tengah pandemi kian tingkat tak kecuali anak muda makin banyak waktu yang harus habis di rumah buat banyak anak muda alih ke online games yang bisa mereka laku sama teman tanpa harus tatap muka ikut kembang sebut prambors bagai radio anak muda selalu upaya untuk ikut kembang kembali hadir prambors skulympic dengan tema e-sport,1
asus luncur laptop seri konvertibel -in- untuk segmen bisnis hadir dalam wujud expertbook b flip b laptop ini merupkana laptop lipat premium kelas enterprise yang desain untuk akselerasi bisnis anda dengan laptop yang satu ini produktivitas saat pergi lebih mudah dari belum dengan koneksi data cepat kilat yang juga fungsi ganda bagai jaring aman pribadi mungkin semua orang kerja tanpa batas desain derajat flippable juga hilang batas tradisional untuk sedia lingkung kerja yang imersif untuk semua butuh bisnis arti expertbook b flip siap bantu tiap organisasi cepat produktivitas tumbuh dan raih hasil,1
saat itu kami dapat kupon jamin oleh tempat duduk di kereta api kenang tjahjo dengan kupon itu tjahjo pulang ke sarang jawa tengah guna kereta api untuk temu konstituen minimal dua kali bulan lama jadi anggota dpr politis lulus fakultas hukum universitas diponegoro ini memang selalu calon diri dari daerah pilih di jawa tengah tempat lahir,0
untuk tahu ada banyak unggul dari perangkat oppo a bukan hanya batas fitur smart driving ini saja oppo a layak jadi pilih karena milik spesifikasi jempol smartphone ini bawa layar inci dengan dukung fitur all-day eye care untuk lindung mata di sektor fotografi milik kamera utama mp kamera bokeh mp kamera makro mp dan kamera selfie mp,1
arsenal vs chelsea akan jadi saji tarik dari premier league akhir pekan ini dua tim saling hadap di stamford bridge pada minggu malam wib november arsenal saat ini adalah puncak klasemen premier league sementara chelsea masih paku di peringkat enam dalam lima tanding akhir di premier league arsenal belum kalah sedang chelsea alam kalah di pekan belum mereka takluk - dari brighton hove albion ini tentu jadi catat sendiri bagi para main bagaimana mereka mesti kembali percaya diri,0
oppo ae oppo ae bekal layar ips lcd hd x pixel ukur inci yang beri tampil lebih luas untuk urus fotografi bekal kamera utama mp dan kamera depan mp yang semat pada bagi poni ppo ae guna chipset mediatek hio p dengan system booster untuk memori sedia dalam konfigurasi gb gb baterai sendiri mah dan padu rangkai fitur isi daya mulai dari super nighttime standby optimized night charging dan super power saving mode untuk harga dibandrol rp juta,1
